ICD9,n_codes,freq_finngen_per,Finnish_name,possible_english_name
2395A,117,0.02927%,NEOPLASMA NON DEF ORGANORUM UROGENITALIUM ALIORUM,Neoplasm of unspecified nature of other genitourinary organs
4271A,117,0.02927%,TACHYCARDIA VENTRICULARIS PAROXYSMALIS,Paroxysmal ventricular tachycardia
4750A,117,0.02927%,PERITONSILLITIS DIFFUSA,Peritonsillar abscess
5839X,117,0.02927%,NEPHRITIS INTERSTITIALIS NUD,"Nephritis and nephropathy, not specified as acute or chronic, with unspecified pathological lesion in kidney"
5322A,116,0.02902%,"ULCUS BULBI,KOMPLISOITUMATON",Acute duodenal ulcer with hemorrhage and perforation
6412B,116,0.02902%,"ABLATIO PLACENTAE ANTETEMPUS,SYNN PÄÄTT HOITOJAKSO",Premature separation of placenta
0609X,115,0.02877%,FEBRIS FLAVA NUD,"Yellow fever, unspecified"
1541A,115,0.02877%,"NEOPLASMA MALIG RECTI,INVASIIVINEN KARSINOOMA",Malignant neoplasm of rectum
5745A,115,0.02877%,"CHOLEDOCHOLITHIASIS SINE CHOLECYSTITIDE,SINE OBSTR",Calculus of bile duct without mention of cholecystitis
7199X,115,0.02877%,"MB ARTICULI NUD,MÄÄRITTELEMÄTÖN",Unspecified disorder of joint
7288X,115,0.02877%,"MORBI MUSCULI, LIGAMENTI ET FASCIAE ALIA DEFINITA","Other disorders of muscle, ligament, and fascia"
3490A,114,0.02852%,LUMBAALIPUNKTION AIHEUTTAMA PÄÄNSÄRKY TAI MUU OIRE,Reaction to spinal or lumbar puncture
5781B,114,0.02852%,HAEMORRHAGIA EX ANO,Blood in stool
7802A,114,0.02852%,COLLAPSUS VASOVAGALIS,Syncope and collapse
4059B,113,0.02827%,HYPERTONIA SECUNDARIA ALIA DEFINITA,Unspecified secondary hypertension
4661A,113,0.02827%,BRONCHIOLITIS ACUTA,Acute bronchiolitis
5322B,113,0.02827%,"ULCUS BULBI,VUOTAVA",Acute duodenal ulcer with hemorrhage and perforation
5739X,113,0.02827%,MORBUS HEPATIS  NUD,Unspecified disorder of liver
7882A,113,0.02827%,RETENTIO URINAE,Retention of urine
0030A,112,0.02802%,GASTROENTERITIS SALMONELLOSA,Salmonella gastroenteritis
2000A,112,0.02802%,LYMPHOMA MALIGNUM FOLLICULARE,Reticulosarcoma
3781A,112,0.02802%,STRABISMUS CONCOMITANS DIVERGENS,Exotropia
6160A,112,0.02802%,CERVICITIS ET ENDOCERVICITIS,Cervicitis and endocervicitis
3018B,111,0.02777%,NARSISTINEN PERSOONALLISUUS,Other personality disorders
3044A,111,0.02777%,AMFETAMIINIRIIPPUVUUS,Amphetamine and other psychostimulant dependence
3153X,111,0.02777%,PUHEEN KEHITYKSEN ERITYISVAIKEUS,Developmental speech or language disorder
7030A,111,0.02777%,UNGUIS INCARNATUS,Ingrowing nail
7169X,111,0.02777%,ARTHROPATHIA NUD,"Arthropathy, unspecified"
8132X,111,0.02777%,FRACTURA RADII ET ULNAE DIAPHYSARIA NON COMPLICATA,"Fracture of shaft of radius and ulna, closed"
2770A,110,0.02752%,MUCOVISCIDOSIS,Cystic fibrosis
2953D,110,0.02752%,"PARANOIDISTYYPPINEN SKITSOFRENIA,SUBKROON AKUUTTI",Paranoid type schizophrenia
4720C,110,0.02752%,RHINITIS VASOMOTORICA,Chronic rhinitis
4809X,110,0.02752%,PNEUMONIA VIROSA NUD,"Viral pneumonia, unspecified"
6178X,110,0.02752%,ENDOMETRIOSIS ALIA DEFINITA,Endometriosis of other specified sites
6213C,110,0.02752%,HYPERPLASIA ENDOMETRII ADEMOMATOSA,Endometrial hyperplasia
6350B,110,0.02752%,"ABORTUS PROV LEGAL SINE COMPL,LÄÄKETIET SYYT (SIK)",Legally induced abortion complicated by genital tract and pelvic infection
6608B,110,0.02752%,MUU MÄÄRITELTY SYNNYTYKSEN PYSÄHTYMINEN,Other causes of obstructed labor
V654A,110,0.02752%,TERVEYSNEUVONTA,"Other counseling, not elsewhere classified"
3453A,109,0.02727%,STATUS EPILEPTICUS GRAND MAL,Grand mal status
4276A,109,0.02727%,EXTRASYSTOLIA SUPRAVENTRICULARIS,Premature beats
5740B,109,0.02727%,"CHOLECYSTOLITHIASIS CUM CHOLECYSTITIDE AC,CUM OBSTR",Calculus of gallbladder with acute cholecystitis
2102A,108,0.02702%,NEOPLASMA BENIGNUM GLANDULAE SALIVALIS,Benign neoplasm of major salivary glands
3640A,108,0.02702%,IRIDOCYCLITIS ACUTA,Acute and subacute iridocyclitis
4130A,108,0.02702%,"ANGINA PECTORIS (""EFFORT ANGINA""),EI AHTAUMAA",Angina decubitus
6425B,108,0.02702%,"PRAE-ECLAMPSIA GRAVIS, SYNNYTYKSEN AIKANA",Severe pre-eclampsia
7859X,108,0.02702%,SYMPTOMA ORG CARDIOVASCULARIS SEU LYMPHATICI ALIA,Other symptoms involving cardiovascular system
7910X,108,0.02702%,PROTEINURIA NUD,Proteinuria
8831A,108,0.02702%,VULNUS DIGITI MANUS COMPLICATUM,"Open wound of finger(s), complicated"
2137A,107,0.02677%,NEOPLASMA BENIGNUM OSSIUM LONGORUM EXTREMITATIS INF,Benign neoplasm of long bones of lower limb
3780A,107,0.02677%,STRABISMUS CONCOMITANS CONVERGENS,Esotropia
4029B,106,0.02652%,CUM DECOMPENSATIONE CORDIS (WHO  III),Unspecified hypertensive heart disease
4059X,106,0.02652%,HYPERTONIA SECUNDARIA NUD,Unspecified secondary hypertension
4229X,106,0.02652%,MYOCARDITIS ACUTA NUD,Other and unspecified acute myocarditis
6545A,106,0.02652%,"INSUFFICIENTIA CERVICIS UTERI, RASKAUDEN AIKANA","Cervical incompetence complicating pregnancy, childbirth, or the puerperium"
6918C,106,0.02652%,DIATHESIS (CONSTITUTIO) ATOPICA,Other atopic dermatitis and related conditions
8240A,106,0.02652%,"FRACTURA MALLEOLI MEDIALIS, NON COMPLICATA","Fracture of medial malleolus, closed"
2953B,105,0.02627%,"PARANOIDISTYYPPINEN SKITSOFRENIA,SUBKROONINEN",Paranoid type schizophrenia
3829X,105,0.02627%,OTITIS MEDIA SUPPURATIVA NUD,Unspecified otitis media
4331X,105,0.02627%,OCCL/STENOSIS ARTERIAE CAROTIS SINE INFARCTU CEREBR,Occlusion and stenosis of carotid artery
6481B,105,0.02627%,HYPOTHYREOSIS IN GRAVIDITATE,"Thyroid dysfunction complicating pregnancy, childbirth, or the puerperium"
6641B,105,0.02627%,LACERATIO PERINEALIS GRADUS II IN PARTU,Second-degree perineal laceration during delivery
6600B,104,0.02602%,TARJONTAHÄIRIÖN AIHEUTTAMA SYNNYTYKSEN PYSÄHTYMINEN,Obstruction caused by malposition of fetus at onset of labor
2391A,103,0.02577%,NEOPLASMA NON DEF ORGANORUM RESPIRATIONIS,Neoplasm of unspecified nature of respiratory system
3755A,103,0.02577%,STENOSIS ET INSUFFICIENTIA CANALIS LACRIMALIS,Stenosis and insufficiency of lacrimal passages
5716A,103,0.02577%,CIRRHOSIS BILIARIS PRIMARIA,Biliary cirrhosis
6221B,103,0.02577%,DYSPLASIA CERVICIS UTERI MODERATA,Dysplasia of cervix (uteri)
6533A,103,0.02577%,"PELVIS ANGUSTA, ANOM APERT INFER,RASKAUDEN AIKANA","Outlet contraction of pelvis in pregnancy, labor, and delivery"
7266E,103,0.02577%,BURSITIS PRAEPATELLARIS,Enthesopathy of knee
7396A,103,0.02577%,"TUKI- JA LIIKUNTAELINTEN TOIM HÄIR,ALARAAJAT","Nonallopathic lesions, lower extremities"
7410D,103,0.02577%,SPINA BIFIDA APERTA CUM HYDROCEPHALO REG LUMBALIS,Spina bifida with hydrocephalus
7881A,103,0.02577%,DYSURIA,Dysuria
8122A,103,0.02577%,FRACTURA HUMERI DIAPHYSEOS NON COMPLICATA,Closed fracture of shaft or unspecified part of humerus
8134X,103,0.02577%,"FRACTURA RADII ET ULNAE DISTALIS,NON COMPLICATA","Fracture of lower end of radius and ulna, closed"
0529X,102,0.02552%,VARICELLA SINE COMPLICATIONE,Varicella without mention of complication
5110B,102,0.02552%,PLEURA-ADHEESIOT,Pleurisy without mention of effusion or current tuberculosis
6349X,102,0.02552%,ABORTUS SPONTANEUS NUD,Spontaneous abortion without mention of complication
6482A,102,0.02552%,ANAEMIA IN GRAVIDITATE,"Anemia complicating pregnancy, childbirth, or the puerperium"
6524B,102,0.02552%,"HABITUS DEFLEXIONIS,SYNNYTYKSEN AIKANA",Face or brow presentation of fetus
7860B,102,0.02552%,HYPERVENTILATIO NUD,Dyspnea and respiratory abnormalities
2252A,101,0.02527%,NEOPLASMA BENIGNUM MENINGUM INTRACRANIALIUM,Benign neoplasm of cerebral meninges
2260A,101,0.02527%,NEOPLASMA BENIGNUM GLANDULAE THYREOIDEAE,Benign neoplasm of thyroid glands
3557X,101,0.02527%,MUU ALARAAJAN MONONEROPATIA,Other mononeuritis of lower limb
5188X,101,0.02527%,MORBI PULMONUM ALII DEFINITA SEU NUD,Other diseases of lung
6280A,101,0.02527%,STERILITAS ET INFERTILITAS ANOVULATORIA PRIM,"Infertility, female, associated with anovulation"
7000A,101,0.02527%,CLAVUS ET CALLOSITAS,Corns and callosities
3641A,100,0.02502%,IRIDOCYCLITIS CHRONICA,Chronic iridocyclitis
7176A,100,0.02502%,MUS ARTICULARIS GENUS,Loose body in knee
4149X,99,0.02477%,"MORBUS ISCHAEMICUS CORDIS NUD,MÄÄRITTELEMÄT","Chronic ischemic heart disease, unspecified"
4260A,99,0.02477%,"DISSOCIATIO ATRIOVENTRICULARIS TOTALIS, GR III","Atrioventricular block, complete"
7234A,99,0.02477%,SYNDROMA RADICULARE BRACHII,Brachial neuritis or radiculitis NOS
7180F,98,0.02452%,"NIVELRUSTON SAIRAUS,POLVI",Articular cartilage disorder
7901A,98,0.02452%,KOHONNUT LASKO,Elevated sedimentation rate
5780A,97,0.02427%,HAEMATEMESIS,Hematemesis
7220A,97,0.02427%,"PROLAPSUS DISCI INTERVERT CERV, SINE MYELO/RHIZOPAT",Displacement of cervical intervertebral disc without myelopathy
2165A,96,0.02402%,"VARTALON IHON BEN KASVAIN,NAEVUS PIGMENTOSUS","Benign neoplasm of skin of trunk, except scrotum"
2959B,96,0.02402%,"ERILAISTUMATON SKITSOFRENIA,SUBKROONINEN",Unspecified schizophrenia
6563A,96,0.02402%,"ASPHYXIA FOETALIS, RASKAUDEN AIKANA",Fetal distress affecting management of mother
6603B,96,0.02402%,MATALA POIKKITILA TAI AVONAINEN TARJONTA,Deep transverse arrest and persistent occipitoposterior position during labor and delivery
8310A,96,0.02402%,"LUXATIO SCAPULAE TRAUMATICA GLENOHUMERALIS,NON COMP",Closed dislocation of shoulder
9982A,96,0.02402%,VAHINGOSSA TAPAHT PUHKAISU TAI REPEÄM TOIMENPIT YHT,"Accidental puncture or laceration during a procedure, not elsewhere classified"
2002A,95,0.02377%,LYMPHOMA MALIGNUM LYMPHOCYTICUM TYPUS BURKITT,Burkitt's tumor or lymphoma
4241B,95,0.02377%,STENOSIS VALVULAE AORTAE (NON RHEUMATICA),Aortic valve disorders
5240A,95,0.02377%,GNATHOANOMALIAE MAJORES,Major anomalies of jaw size
5589X,95,0.02377%,MUU EI-INFEKTIOOSI SUOLISTOSAIRAUS,Other and unspecified noninfectious gastroenteritis and colitis
6534A,95,0.02377%,"DISPROPORTIO FOETOPELVICA,RASKAUDEN AIKANA",Fetopelvic disproportion
8450A,95,0.02377%,"DISTORSIO,DISTENSIO/RUPT.LIGAMENTI DELTOIDEI TARSI",Ankle sprain
9222A,95,0.02377%,CONTUSIO ABDOMINIS,Contusion of abdominal wall
3469X,94,0.02352%,HEMICRANIA NUD,"Migraine, unspecified"
8233D,94,0.02352%,"FRACTURA DIAPHYSEOS TIBIAE/FIBULAE COMMINUTA, COMPL","Fracture of shaft of tibia and fibula, open"
1733A,93,0.02327%,"KASVOJEN IHON SYÖPÄ,CA BASOCELLULARE",Other and unspecified malignant neoplasm of skin of other and unspecified parts of face
2030A,93,0.02327%,MYELOMA MULTIPLEX,Multiple myeloma
2448A,93,0.02327%,HYPOTHYREOSIS POST THYREOIDITIDEM,Other specified acquired hypothyroidism
3780B,93,0.02327%,STRABISMUS CONVERGENS ALTERNANS,Esotropia
6221C,93,0.02327%,DYSPLASIA CERVICIS UTERI GRAVIS,Dysplasia of cervix (uteri)
7179X,93,0.02327%,MORBUS MENISCI ET LIGAMENTORUM ALIA GENUS NUD,Unspecified internal derangement of knee
7950A,92,0.02302%,EPÄSPESIFINEN POIKKEAVA KOHDUNSUUN SYTOLOGIA,Abnormal Papanicolaou smear of cervix and cervical HPV
4120C,91,0.02277%,"STATUS POST INFARCTUM CORDIS,TROMBI",Old myocardial infarction
4476A,91,0.02277%,"VASCULITIS, ARTERITIS SEU ENDARTERITIS NUD","Arteritis, unspecified"
5275A,91,0.02277%,SIALOLITHIASIS,Sialolithiasis
5691A,91,0.02277%,PROLAPSUS RECTI,Rectal prolapse
5828B,91,0.02277%,"GLOMERULONEPHRITIS CHRONICA ALIA DEF,NEFR SDR",Chronic glomerulonephritis with other specified pathological lesion in kidney
7358X,91,0.02277%,DEFORMATIO DIGITI PEDIS ALIA DEFINITA ACQUISITA,Other acquired deformities of toe
1330A,90,0.02252%,SCABIES,Scabies
1745A,90,0.02252%,"RINTASYÖPÄ,ALALATERAALINELJÄNNES",Malignant neoplasm of lower-outer quadrant of female breast
3010A,90,0.02252%,EPÄLUULOINEN PERSOONALLISUUS,Paranoid personality disorder
7199L,90,0.02252%,"MB ARTICULI NUD,USEAT NIVELET",Unspecified disorder of joint
7545B,90,0.02252%,TALIPES EQUINOVARUS CONGENITUS,"Varus deformities of feet, congenital"
6568A,89,0.02227%,"MUUT SIKIÖN/IST HÄIR, ÄIDIN TUTK TAI HOITO,RASK AIK",Other specified fetal and placental problems affecting management of mother
7263B,89,0.02227%,EPICONDYLITIS MEDIALIS HUMERI,Enthesopathy of elbow region
7330A,89,0.02227%,OSTEOPOROSIS CENTRALIS,Osteoporosis
9060A,89,0.02227%,"SEQUELAE VULNERUM CAPITIS, COLLI ET TRUNCI","Late effect of open wound of head, neck, and trunk"
4309X,88,0.02202%,HAEMORRHAGIA SUBARACHNOIDALIS NUD,Subarachnoid hemorrhage
7071A,88,0.02202%,ULCUS EXTREMITATIS INFERIORIS,"Ulcer of lower limbs, except pressure ulcer"
0769C,87,0.02177%,CHLAMYDIA ENDOMETRITIS ET SALPINGO-OOPHORITIS,"Trachoma, unspecified"
5680A,87,0.02177%,ADHESIONES PERITONEALE,Peritoneal adhesions (postoperative) (postinfection)
6609B,87,0.02177%,TARKEMMIN MÄÄRITTELEMÄTÖN  SYNNYTYKSEN PYSÄHTYMINEN,Unspecified obstructed labor
7241A,87,0.02177%,DOLORES COLUMNAE THORACALIS,Pain in thoracic spine
9953A,87,0.02177%,"ALLERGIA, TARKEMMIN MÄÄRITTELEMÄTÖN","Allergy, unspecified, not elsewhere classified"
3093A,86,0.02152%,KÄYTÖSHÄIRIÖNÄ ILMENEVÄ SOPEUTUMISHÄIRIÖ,Adjustment disorder with disturbance of conduct
3159X,86,0.02152%,MUU MÄÄRITELTY KEHITYKSEN ERITYISVAIKEUS,Unspecified delay in development
3793A,86,0.02152%,APHAKIA,Aphakia and other disorders of lens
8233C,86,0.02152%,"FRACTURA DIAPHYSEOS TIBAE ET FIBULAE, COMPLICATA","Fracture of shaft of tibia and fibula, open"
3003A,85,0.02127%,NEUROSIS OBSESSIVA-COMPULSIVA,Obsessive-compulsive disorders
3429X,85,0.02127%,HEMIPLEGIA,"Hemiplegia, unspecified"
7165A,85,0.02127%,POLYARTHRITIS NUD,Unspecified polyarthropathy or polyarthritis
7842A,85,0.02127%,TUMOR COLLI NUD,"Swelling, mass, or lump in head and neck"
6102A,84,0.02102%,FIBROADENOMATOSIS MAMMAE,Fibroadenosis of breast
6532B,84,0.02102%,"PELVIS ANGUSTA, ANOM APERT SUPER,SYNNYTYKSEN AIKANA","Inlet contraction of pelvis in pregnancy, labor, and delivery"
6690A,84,0.02102%,"""MATERNAL DISTRESS""",Maternal distress
2121A,83,0.02076%,NEOPLASMA BENIGNUM LARYNGIS,Benign neoplasm of larynx
2952C,83,0.02076%,"KATATOONISTYYPPINEN SKITSOFRENIA,KROONINEN",Catatonic type schizophrenia
3813X,83,0.02076%,OTITIS MEDIA NONSUPPURATIVA ACUTA ALIA SEU NUD,Other and unspecified chronic nonsuppurative otitis media
4251A,83,0.02076%,CARDIOMYOPATHIA HYPERTROPHICA,Hypertrophic cardiomyopathy
6350A,83,0.02076%,"ABORTUS PROV LEGAL SINE COMPL,LÄÄKETIET SYYT (ÄID)",Legally induced abortion complicated by genital tract and pelvic infection
6411A,83,0.02076%,"PLACENTA PRAEVIA CUM HAEMORRHAGIA,HOITOJ ENNEN SYNN",Hemorrhage from placenta previa
7263C,83,0.02076%,BURSITIS OLECRANI,Enthesopathy of elbow region
8132A,83,0.02076%,FRACTURA RADII DIAPHYSARIA NON COMPLICATA,"Fracture of shaft of radius and ulna, closed"
9061A,83,0.02076%,"SEQUALAE VULNERAM EXTREMITATUM, TENDINI EXCEPTA",Late effect of open wound of extremities without mention of tendon injury
1890B,82,0.02051%,"NEOPL MAL RENIS PELVI EXCEPTO,ADENOCARCINOMA","Malignant neoplasm of kidney, except pelvis"
3499X,82,0.02051%,MORBI SYSTEMATIS NERVORUM NUD,Unspecified disorders of nervous system
4100B,82,0.02051%,"INFARCTUS MYOCARDII ACUTUS DEFINITUS,AHTAUTUNUT","Acute myocardial infarction, of anterolateral wall"
5233A,82,0.02051%,PARODONTITIS ACUTA,Aggressive and acute periodontitis
6288B,82,0.02051%,STERILITAS ET INFERTILITAS MULIERIS ALIA SEC,"Infertility, female, of other specified origin"
6409X,82,0.02051%,HAEMORHAGIA EX UTERO GRAVIDARUM NUD,Unspecified hemorrhage in early pregnancy
6525B,82,0.02051%,"KORKEALLE JÄÄNYT TARJOUTUVA SIKIÖN PÄÄ,SYNN AIKANA",High fetal head at term
7188F,82,0.02051%,"MB ARTICULI, LIGAM ET CARTILAG AL DEF,POLVI","Other joint derangement, not elsewhere classified"
8450X,82,0.02051%,"DISTORSIO,DISTENSIO SEU RUPTURA TARSI ALIA",Ankle sprain
3160A,81,0.02026%,PSYYK TEKIJÄT ORGAANISTEN SAIRAUKSIEN/OIREIDEN YHTE,Psychic factors associated with diseases classified elsewhere
8082A,81,0.02026%,"FRACTURA OSSIS PUBIS, NON COMPLICATA",Closed fracture of pubis
1890A,80,0.02001%,"NEOPL MAL RENIS PELVI EXCEPTO,NEPHROBLASTOMA","Malignant neoplasm of kidney, except pelvis"
2009X,80,0.02001%,LYMPHOMA MALIGNUM (NON-HODGKIN) NUD,Lymphosarcoma and reticulosarcoma and other specified malignant tumors of lymphatic tissue
2790B,80,0.02001%,DEFICIENTIA IMMUNOGLOBULINI A,Deficiency of humoral immunity
5586X,80,0.02001%,"KROONINEN INFLAMMATOORINEN SUOLISTOSAIRAUS, NUD",Other and unspecified noninfectious gastroenteritis and colitis
6564A,80,0.02001%,"MORS FOETALIS INTRAUTERINA, RASKAUDEN AIKANA",Intrauterine death affecting management of mother
8026A,80,0.02001%,"FRACTURA ORBITAE (""BLOW-OUT FRACTURE"")",Closed fracture of orbital floor (blow-out)
2962A,79,0.01976%,PSYCHOSIS BIPOLARIS MANICA NUD,"Major depressive disorder, single episode"
4272A,79,0.01976%,TACHYCARDIA PAROXYSMALIS NUD,"Paroxysmal tachycardia, unspecified"
4878X,79,0.01976%,INFLUENZA ALIA DEFINITA SEU NUD,Influenza with other manifestations
5750A,79,0.01976%,CHOLECYSTITIS ACUTA SINE CHOLELITHIASI,Acute cholecystitis
6461A,79,0.01976%,OEDEMA GRAVIDARUM,"Edema or excessive weight gain in pregnancy, without mention of hypertension"
7211A,79,0.01976%,SPONDYLARTHROSIS CERVICALIS CUM MYELOPATHIA,Cervical spondylosis with myelopathy
2964C,78,0.01951%,"PSYCHOSIS BIPOLARIS CIRCULARIS,KESKIVAIKEA","Bipolar I disorder, most recent episode (or current) manic"
3454X,78,0.01951%,ALII DISTURBATIONES CONSCIENTAE EPILEPTICI,Localization-related (focal) (partial) epilepsy and epileptic syndromes with complex partial seizures
3824A,78,0.01951%,RESIDUA POST OTITIDEM MEDIAM,Unspecified suppurative otitis media
4810A,78,0.01951%,PNEUMONIA PNEUMOCOCCICA,Pneumococcal pneumonia [Streptococcus pneumoniae pneumonia]
4910A,78,0.01951%,BRONCHITIS CHRONICA NON PURULENTA,Simple chronic bronchitis
7444B,78,0.01951%,CYSTA BRANCHIOGENICA,Branchial cleft cyst or fistula; preauricular sinus
8202A,78,0.01951%,"FRACTURA COLLI FEMORIS PERTROCHANTERICA,NON COMPLIC","Pertrochanteric fracture of femur, closed"
8250A,78,0.01951%,"FRACTURA CALCANEI, NON COMPLICATA","Fracture of calcaneus, closed"
0750A,77,0.01926%,MONONUCLEOSIS INFECTIOSA CUM COMPLICATIONE,Infectious mononucleosis
2251A,77,0.01926%,NEOPLASMA BENIGNUM NERVORUM CRANIALIUM,Benign neoplasm of cranial nerves
2451A,77,0.01926%,THYREOIDITIS SUBACUTA,Subacute thyroiditis
5650C,77,0.01926%,FISSURA ANI ALIA,Anal fissure
5714X,77,0.01926%,HEPATITIS CHRONICA ALIA SEU NUD,Chronic hepatitis
6142X,77,0.01926%,S-O-ITIS CHRONICA ALIA,"Salpingitis and oophoritis not specified as acute, subacute, or chronic"
6221A,77,0.01926%,DYSPLASIA CERVICIS UTERI LEVIS,Dysplasia of cervix (uteri)
6339X,77,0.01926%,GRAVIDITAS ECTOPICA NUD,Unspecified ectopic pregnancy
9059A,77,0.01926%,SEQUELAE AMPUTATIONIS TRAUMATICAE,Late effect of traumatic amputation
2500C,76,0.01901%,"DIABETES MELLITUS SINE COMPLICATIONE ,MODY",Diabetes mellitus without mention of complication
3784B,76,0.01901%,EXOPHORIA,Heterophoria
5772A,76,0.01901%,CYSTA ET PSEUDOCYSTA PANCREATIS,Cyst and pseudocyst of pancreas
7893A,76,0.01901%,TUMOR ABDOMINIS NUD,"Abdominal or pelvic swelling, mass, or lump"
8252E,76,0.01901%,"FRACTURA OSSIS METATARSALIS, NON COMPLICATA","Fracture of other tarsal and metatarsal bones, closed"
8500X,76,0.01901%,"COMMOTIO CEREBRI,TAJUTTOMUUDEN KESTOSTA EI TIETOA",Concussion with no loss of consciousness
8822A,76,0.01901%,"VULNUS MANUS, DIG.EXCEPTO+LAESIO TENDINIS,NON COMPL","Open wound of hand except finger(s) alone, with tendon involvement"
2952E,75,0.01876%,"KATATOONISTYYPPINEN SKITSOFRENIA,KROONINEN AKUUTTI",Catatonic type schizophrenia
3008A,75,0.01876%,SOMATISAATIOHÄIRIÖ,Somatoform disorders
4720A,75,0.01876%,RHINITIS CHRONICA HYPERTROPHICA,Chronic rhinitis
5225A,75,0.01876%,ABSCESSUS PERIAPICALIS (DENTOALVEOLARIS),Periapical abscess without sinus
5354X,75,0.01876%,GASTRITIS CHRONICA ALIA,Other specified gastritis
5742B,75,0.01876%,"CHOLECYSTOLITHIASIS SINE CHOLECYSTITIDE,CUM OBSTR",Calculus of gallbladder without mention of cholecystitis
6269X,75,0.01876%,MENSTRUATIO ABNORMA NUD,Unspecified disorders of menstruation and other abnormal bleeding from female genital tract
7561A,75,0.01876%,SPONDYLOLISTHESIS CONGENITA,"Anomalies of spine, congenital"
2510B,74,0.01851%,COMA HYPOGLYCAEMICUM,Hypoglycemic coma
2512X,74,0.01851%,HYPOGLYCAEMIA NUD,"Hypoglycemia, unspecified"
2768A,74,0.01851%,HYPOKALAEMIA,Hypopotassemia
3012A,74,0.01851%,ERISTÄYTYVÄ PERSOONALLISUUS,Schizoid personality disorder
3138B,74,0.01851%,IDENTITEETTIHÄIRIÖ,Other or mixed emotional disturbances of childhood or adolescence
3801A,74,0.01851%,OTITIS EXTERNA ACUTA DIFFUSA,Infective otitis externa
4373A,74,0.01851%,ANEURYSMA ARTERIAE CEREBRALIS NONRUPTURANS,"Cerebral aneurysm, nonruptured"
6566B,74,0.01851%,"SIK YLIPAIN RASK KESTOON NÄHDEN, SYNNYTYKSEN AIKANA",Excessive fetal growth affecting management of mother
6570A,74,0.01851%,"POLYHYDRAMNION, RASKAUDEN AIKANA",Polyhydramnios
8832B,74,0.01851%,"VULNUS DIGITI MANUS CUM LAESIONE TENDINIS,COMPLICAT","Open wound of finger(s), with tendon involvement"
1048A,73,0.01826%,MORBUS LYME,Other specified spirochetal infections
1380A,73,0.01826%,SEQUELAE POLIOMYELITIDIS,Late effects of acute poliomyelitis
3002B,73,0.01826%,LAAJA-ALAINEN PANIIKKIHÄIRIÖ,Phobic disorders
4059A,73,0.01826%,HYPERTONIA RENOVASCULARIS,Unspecified secondary hypertension
5307A,73,0.01826%,SYNDROMA MALLORY-WEISS,Gastroesophageal laceration-hemorrhage syndrome
5756A,73,0.01826%,CHOLESTEROSIS VESICAE FELLAE,Cholesterolosis of gallbladder
7250A,73,0.01826%,POLYMYALGIA RHEUMATICA,Polymyalgia rheumatica
7834C,73,0.01826%,HÄIRIINTYNYT PITUUSKASVU,Lack of expected normal physiological development in childhood
8232D,73,0.01826%,"FRACT DIAPHYSEOS TIBIAE/FIBULAE COMMINUTA,NON COMPL","Fracture of shaft of tibia and fibula, closed"
8501B,73,0.01826%,"COMMOTIO CEREBRI COMPLICATA,EI TAJUTTOMUUTTA",Concussion with brief loss of consciousness
2773B,72,0.01801%,AMYLOIDOSIS SECUNDARIA,Amyloidosis
6752A,72,0.01801%,MASTITIS NON PURULENTA PUERP AIKANA,Nonpurulent mastitis associated with childbirth
6930B,72,0.01801%,EXANTHEMA EX USU PHARMACIS,Dermatitis due to drugs and medicines taken internally
7543B,72,0.01801%,SUBLUXATIO COXAE CONGENITA,Congenital dislocation of hip
7872A,72,0.01801%,DYSPHAGIA,Dysphagia
8052A,72,0.01801%,"RINTARANGAN KOMPRESSIOMURTUMA,EI SELKÄYDINVAURIOTA",Closed fracture of dorsal [thoracic] vertebra without mention of spinal cord injury
8084A,72,0.01801%,"FRACTURA PELVIS ALIA DEFINITA, NON COMPLICATA",Closed fracture of other specified part of pelvis
8821A,72,0.01801%,"VULNUS MANUS, DIGITO EXCEPTO COMPLICATUM","Open wound of hand except finger(s) alone, complicated"
8860A,72,0.01801%,AMPUTATIO TRAUMATICA DIGITI ALTERIUS NON COMPLICATA,"Traumatic amputation of other finger(s) (complete) (partial), without mention of complication"
4719X,71,0.01776%,POLYPUS NASALIS NUD,Unspecified nasal polyp
6110A,71,0.01776%,MASTITIS,Inflammatory disease of breast
6163A,71,0.01776%,ABSCESSUS GLANDULAE BARTHOLINI,Abscess of Bartholin's gland
7118L,71,0.01776%,"ARTHRITIS POSTINFECTIOSA ALIA,  USEAT NIVELET",Arthropathy associated with other infectious and parasitic diseases
7490A,71,0.01776%,PALATOSCHISIS COMPLETA,Cleft palate
7869X,71,0.01776%,SYMPTOMA RESPIRATORIA ALIA DEFINITA,Other symptoms involving respiratory system and chest
8830A,71,0.01776%,VULNUS DIGITI MANUS NON COMPLICATUM,"Open wound of finger(s), without mention of complication"
V614A,71,0.01776%,PERHEESSÄ OLEVA TERVEYSONGELMA,Health problems within family
3140B,70,0.01751%,TARKKAAVAISUUSHÄIRIÖ,Attention deficit disorder of childhood
3510A,70,0.01751%,PARESIS BELL,Bell's palsy
3556A,70,0.01751%,LAESIO NERVI PLANTARIS,Lesion of plantar nerve
6078B,70,0.01751%,IMPOTENTIA ORGANICA,Other specified disorders of penis
7178A,70,0.01751%,LAESIO LIGAMENTI COLLATERALIS MEDIALIS,Other internal derangement of knee
7273A,70,0.01751%,BURSITIS ALIA,Other bursitis
7291A,70,0.01751%,MYALGIA NUD,"Myalgia and myositis, unspecified"
7492A,70,0.01751%,CHEILOPALATOSCHISIS UNILATERALIS COMPLETA,Cleft palate with cleft lip
2520A,69,0.01726%,HYPERPARATHYREOIDISMUS,Hyperparathyroidism
2920A,69,0.01726%,SYMPTOMATA ABSTINENTIA EX USU MEDICAMENTORUM,Drug withdrawal
4131X,69,0.01726%,"ANGINA PECTORIS INVERSA ,MÄÄRITTELEMÄT",Prinzmetal angina
4360A,69,0.01726%,MORBUS CEREBROVASCULARIS ACUTUS NON DEFINITUS,"Acute, but ill-defined, cerebrovascular disease"
4871A,69,0.01726%,INFLUENZA CUM SYMPTOMATE RESPIRATORIO ALIO,Influenza with other respiratory manifestations
4919X,69,0.01726%,BRONCHITIS CHRONICA NUD,Unspecified chronic bronchitis
5509C,69,0.01726%,"HERNIA INGUINALIS SINE GANGR/OBSTR,COMBINATA","Inguinal hernia, without mention of obstruction or gangrene"
6450A,69,0.01726%,GRAVIDITAS PROLONGATA ANTE PARTUM,Late pregnancy
6653B,69,0.01726%,RUPTURA CERVICIS UTERI IN PARTUM,Obstetrical laceration of cervix
6661X,69,0.01726%,HAEMORRHAGIA POST PARTUM ACUTA ALIA,Other immediate postpartum hemorrhage
7151H,69,0.01726%,"OSTEOARTHROSIS PRIMARIA, JALKATERÄ","Osteoarthrosis, localized, primary"
7823A,69,0.01726%,OEDEMA,Edema
9050A,69,0.01726%,SEQUELAE FRACTURAE CRANII ET OSSIUM FACIEI,Late effect of fracture of skull and face bones
3548X,68,0.01701%,MUU YLÄRAAJAN MONONEUROPATIA,Other mononeuritis of upper limb
5241A,68,0.01701%,GNATHOANOMALIAE AD BASIM CRANII,Anomalies of relationship of jaw to cranial base
5965F,68,0.01701%,ALIA INCONTINENTIA URINAE DEFINITA,Other functional disorders of bladder
6140B,68,0.01701%,S-O-ITIS ACUTA CUM IUD,Acute salpingitis and oophoritis
7151A,68,0.01701%,"OSTEOARTHROSIS PRIMARIA, OLKANIVEL","Osteoarthrosis, localized, primary"
7850A,68,0.01701%,TACHYCARDIA NUD,"Tachycardia, unspecified"
3079X,67,0.01676%,SYNDROMA PSYCHOGENICA ALIA DEFINITA,"Other and unspecified special symptoms or syndromes, not elsewhere classified"
3314A,67,0.01676%,HYDROCEPHALUS OBSTRUCTIVUS,Obstructive hydrocephalus
3808A,67,0.01676%,EXOSTOSIS MEATUS ACUSTICI EXTERNI,Other disorders of external ear
4259X,67,0.01676%,CARDIOMYOPATHIA NUD,"Secondary cardiomyopathy, unspecified"
7058C,67,0.01676%,HIDRADENITIS SUPPURATIVA,Other specified disorders of sweat glands
7102B,67,0.01676%,SYNDROMA SICCUM SECUNDARIUM,Sicca syndrome
7851A,67,0.01676%,PALPITATIO,Palpitations
9663A,67,0.01676%,MYRKYTYS:KARBAMATSEPIINI,Poisoning by other and unspecified anticonvulsants
