ICD9,n_codes,freq_finngen_per,Finnish_name,possible_english_name
8640A,13,0.00325%,LAESIO TRAUMATICA HEPATIS NON COMPLICATA,Injury to liver without mention of open wound into cavity
8731A,13,0.00325%,VULNUS CUTIS CAPITIS COMPLICATUM,"Open wound of scalp, complicated"
9064A,13,0.00325%,MURSKAVAMMOJEN JÄLKITILAT,Late effect of crushing
9238X,13,0.00325%,CONTUSIO EXTREMITATIS SUPERIORIS LOCO MULTIPLICI,Contusion of multiple sites of upper limb
9300A,13,0.00325%,CORPUS ALIENUM CORNEAE,Corneal foreign body
9963A,13,0.00325%,"UROGEN SIJOIT LAITTEEN, IMPLANT TAI SIIRR MEK KOMPL","Mechanical complication of genitourinary device, implant, and graft"
0059X,12,0.00300%,INTOXICATIO ALIMENTARIA NUD,"Food poisoning, unspecified"
0544B,12,0.00300%,"KERATITIS DENDRITICA, HERPETICA",Herpes simplex with ophthalmic complications
0980A,12,0.00300%,GONORRHOEA ACUTA REGIONIS UROGENITALIS INFERIORIS,Gonococcal infection (acute) of lower genitourinary tract
1522B,12,0.00300%,"NEOPLASMA MALIGNUM ILEI,ALIA DEFINITA SEU NUD",Malignant neoplasm of ileum
1625X,12,0.00300%,"NEOPL MAL LOBI INFERIORIS PULMONIS,EI HIST/SYTOL DG","Malignant neoplasm of lower lobe, bronchus or lung"
1727D,12,0.00300%,"MELANOMA MAL CUTIS EXTR INFER,MUU TAI TARK MÄÄR","Malignant melanoma of skin of lower limb, including hip"
2113A,12,0.00300%,ADENOMA VILLOSUM  COLI,Benign neoplasm of colon
2152D,12,0.00300%,"YLÄRAAJAN BENIGNI PEHMYTKUDOSKASVAIN,MUU","Other benign neoplasm of connective and other soft tissue of upper limb, including shoulder"
2161X,12,0.00300%,"SILMÄLUOMEN BEN KASVAIN,TARK MÄÄRITT HYVÄNLAAT KASV","Benign neoplasm of eyelid, including canthus"
2165G,12,0.00300%,"VARTALON IHON BEN KASVAIN,MUU MÄÄR HYVÄNLAAT KASV","Benign neoplasm of skin of trunk, except scrotum"
2259X,12,0.00300%,NEOPLASMA BENIGNUM SYSTEMATIS NERVORUM  NUD,"Benign neoplasm of nervous system, part unspecified"
2281A,12,0.00300%,LYMPHANGIOMA,"Lymphangioma, any site"
2423X,12,0.00300%,MYRKKYSTRUUMA TARKEMMIN MÄÄRITTELEMÄTÖN,"Toxic nodular goiter, unspecified type"
2443X,12,0.00300%,HYPOTHYREOSIS IATROGENEA ALIA,Other iatrogenic hypothyroidism
2550A,12,0.00300%,SDR CUSHING E HYPERPLASIA GLANDULAE SUPRARENALI,Cushing's syndrome
2590A,12,0.00300%,PUBERTAS TARDA,"Delay in sexual development and puberty, not elsewhere classified"
2914A,12,0.00300%,PATOLOGINEN ALKOHOLIPÄIHTYMYS,Idiosyncratic alcohol intoxication
2921C,12,0.00300%,HALLUCINOSIS EX USU MEDICAMENTORUM,Drug-induced psychotic disorders
3561A,12,0.00300%,ATROPHIA MUSCULI PERONEI,Peroneal muscular atrophy
3656B,12,0.00300%,"GLAUKOMASYKLIITTINEN KRIISI,SYNDR POSSNER-SCHOSSMAN",Glaucoma associated with other ocular disorders
3723A,12,0.00300%,CONJUNCTIVITIS ALIA,Other and unspecified conjunctivitis
3732A,12,0.00300%,CHALAZION,Chalazion
3781X,12,0.00300%,STRABISMUS DIVERGENS ALIUS,Exotropia
3960A,12,0.00300%,MORBI VALVULARUM MITRALIUM ET AORTAE RHEUMATICI,Mitral valve stenosis and aortic valve stenosis
4519X,12,0.00300%,PHLEBITIS/THROMBOPHLEBITIS/TROMBOSIS PHLEBARUM NUD,Phlebitis and thrombophlebitis of unspecified site
4786A,12,0.00300%,OEDEMA LARYNGIS,Edema of larynx
5128X,12,0.00300%,PNEUMOTHORAX SPONTANEUS ALIA,Other pneumothorax and air leak
5264A,12,0.00300%,CONDITIO INFLAMMATORIA MAXILLAE SEU MANDIBULAE,Inflammatory conditions of jaw
5369X,12,0.00300%,MAHALAUKUN TOIMINTAHÄIRIÖ NUD,Unspecified functional disorder of stomach
5699X,12,0.00300%,MORBUS INTESTINI NUD,Unspecified disorder of intestine
5779X,12,0.00300%,HAIMASAIRAUS NUD,Unspecified disease of pancreas
5809B,12,0.00300%,"GLOMERULONEPHRITIS ACUTA NUD,NEFR SDR",Acute glomerulonephritis with unspecified pathological lesion in kidney
5938X,12,0.00300%,MORBI RENIS ET URETERI ALIA DEFINITA,Other specified disorders of kidney and ureter
5993A,12,0.00300%,CARUNCULUS URETHRAE,Urethral caruncle
6190A,12,0.00300%,FISTULA UROGENITALIS,"Urinary-genital tract fistula, female"
6229X,12,0.00300%,MORBI NONINFECTIOSI CERVICIS UTERI NUD,Unspecified noninflammatory disorder of cervix
6245A,12,0.00300%,HAEMATOMA VULVAE,Hematoma of vulva
6463A,12,0.00300%,"""HABITUAL ABORTER""",Recurrent pregnancy loss
6599A,12,0.00300%,"INDICATIONES INTERVENTIONUM NUD,RASKAUDEN AIKANA",Unspecified indication for care or intervention related to labor and delivery
6924N,12,0.00300%,DERMATITIS ARTEFACTA E CHEMICALIBUS ALIIS ALLERGICA,Contact dermatitis and other eczema due to other chemical products
6927F,12,0.00300%,ERUPTIO POLYMORPHICA SOLARIS,Contact dermatitis and other eczema due to solar radiation
6988X,12,0.00300%,PRURITUS ALIA DEFINITA,Other specified pruritic conditions
7188G,12,0.00300%,"MB ARTICULI, LIGAM ET CARTILAG AL DEF,NILKKA","Other joint derangement, not elsewhere classified"
7283X,12,0.00300%,MORBI MUSCULI ALII,Other specific muscle disorders
7296A,12,0.00300%,PEHMYTOSIEN VIERASESINE (VANHA),Residual foreign body in soft tissue
7300G,12,0.00300%,"OSTEOMYELITIS ACUTA,NILKKA JA JALKA",Acute osteomyelitis
7332A,12,0.00300%,CYSTA SOLITARIA OSSIS,Cyst of bone
7443X,12,0.00300%,ANOMALIAE CONGENITAE AURIS NUD,Unspecified anomaly of ear
7463D,12,0.00300%,BIKUSPINEN AORTALÄPPÄ,Congenital stenosis of aortic valve
7512X,12,0.00300%,MALEFORMATIO ANORECTALIS ALIA DEFINITA,"Atresia and stenosis of large intestine, rectum, and anal canal"
7821A,12,0.00300%,ERUPTIO CUTANEA,Rash and other nonspecific skin eruption
7841A,12,0.00300%,PHARYNGALGIA,Throat pain
7844C,12,0.00300%,DYSPHONIA FUNCTIONALIS ALIA,Voice and resonance disorders
7910A,12,0.00300%,PROTEINURIA POSTURALIS,Proteinuria
7929X,12,0.00300%,MUU EPÄSPESIFINEN POIKKEAVA LABORATORIOLÖYDÖS,Other nonspecific abnormal findings in body substances
7999X,12,0.00300%,MUUT TUNTEMATT/TARK MÄÄRITTELEM SAIR/KUOLEMAN SYYT,Other unknown and unspecified cause of morbidity and mortality
8150D,12,0.00300%,"FRACTURA COLLI METACARPI, NON COMPLICATA",Closed fracture of metacarpal bones
8261A,12,0.00300%,FRACTURA DIGITI PEDIS COMPLICATA,Open fracture of one or more phalanges of foot
8340A,12,0.00300%,"LUXATIO METACARPOPHALANGEALIS, NON COMPLICATA",Closed dislocation of finger
8715A,12,0.00300%,VULNUS OCULI PENETRANS CUM CORPORE ALIENO MAGNETICO,Penetration of eyeball with magnetic foreign body
8717X,12,0.00300%,VULNUS BULBI OCULI PENETRANS NUD,Unspecified ocular penetration
8840A,12,0.00300%,VULNERA MULTIPLICIA/NUD EXTREMIT. SUPERI.NON COMPL,"Multiple and unspecified open wound of upper limb, without mention of complication"
8851A,12,0.00300%,AMPUTATIO TRAUMATICA POLLICIS (TOT/PART)COMPLICATA,"Traumatic amputation of thumb (complete)(partial), complicated"
9100A,12,0.00300%,"ABRASIO NONINFECTIOSA   FACIEI, COLLI ET VERTICIS","Abrasion or friction burn of face, neck, and scalp except eye, without mention of infection"
9229X,12,0.00300%,CONTUSIO TRUNCI NUD,Contusion of unspecified part of trunk
9421A,12,0.00300%,"COMBUSTIO TRUNCI GRADUS I, <9%",Erythema due to burn [first degree] of trunk
9664A,12,0.00300%,MYRKYTYS:PARKINSONIN TAUDIN LÄÄKKEET,Poisoning by anti-Parkinsonism drugs
9724A,12,0.00300%,MYRKYTYS:KALSIUMINESTÄJÄT,Poisoning by coronary vasodilators
9757A,12,0.00300%,MYRKYTYS:MUUT ASTMALÄÄKKEET,Poisoning by antiasthmatics
V702A,12,0.00300%,MIELENTILATUTKIMUS,"General psychiatric examination, other and unspecified"
0085X,11,0.00275%,ENTERITIS BACTERIA ALIA SEU NUD,"Bacterial enteritis, unspecified"
0112A,11,0.00275%,"TUBERCULOSIS PULMONUM CAVERNOSA, BAKTERIOL.VARMA",Tuberculosis of lung with cavitation
0340G,11,0.00275%,"TONSILLITIS STREPTOCOCCICA,STREPTOC BETAHAEMOLYT-G",Streptococcal sore throat
0410A,11,0.00275%,INFECTIO STREPTOCOCCUS,Streptococcus infection in conditions classified elsewhere and of unspecified site
0411A,11,0.00275%,INFECTIO STAPHYLOCOCCUS,Staphylococcus infection in conditions classified elsewhere and of unspecified site
0913A,11,0.00275%,SYPHILIS SECUNDARIA CUTANEA SIVE MUCOSA,Secondary syphilis of skin or mucous membranes
1252A,11,0.00275%,FILARIASIS LOIA,Loiasis
1726B,11,0.00275%,"MELANOMA MAL CUTIS EXTR SUPER,SUPERFICIAL SPREAD","Malignant melanoma of skin of upper limb, including shoulder"
1727B,11,0.00275%,"MELANOMA MAL CUTIS EXTR INFER,SUPERFICIAL SPREAD","Malignant melanoma of skin of lower limb, including hip"
1732A,11,0.00275%,"KORVAN IHON SYÖPÄ,CA BASOCELLULARE",Other and unspecified malignant neoplasm of skin of ear and external auditory canal
1880A,11,0.00275%,NEOPLASMA MALIGNUM TRIGONI VESICAE URINARIAE,Malignant neoplasm of trigone of urinary bladder
2113B,11,0.00275%,ADENOMA TUBULOVILLOSUM COLI,Benign neoplasm of colon
2220A,11,0.00275%,NEOPLASMA BENIGNUM TESTIS,Benign neoplasm of testis
2271A,11,0.00275%,NEOPLASMA BENIGNUM GLANDULAE PARATHYREOIDEAE,Benign neoplasm of parathyroid gland
3200A,11,0.00275%,MENINGITIS E HAEMOPHILUS INFLUENZAE,Hemophilus meningitis
3438X,11,0.00275%,PARESIS CEREBRALIS INFANTILIS ALIA DEFINITA,Other specified infantile cerebral palsy
3628X,11,0.00275%,MORBUS RETINAE ALIA DEFINITA,Other retinal disorders
3630A,11,0.00275%,CHORIORETINITIS FOCALIS,Focal chorioretinitis and focal retinochoroiditis
3632A,11,0.00275%,CHORIORETINITIS ALIA DEFINITA,Other and unspecified forms of chorioretinitis and retinochoroiditis
3642X,11,0.00275%,IRIDOCYCLITIS ALIA,Certain types of iridocyclitis
3651C,11,0.00275%,MATALAPAINEGLAUKOOMA,Open-angle glaucoma
3660A,11,0.00275%,CATARACTA INFANTILIS,"Infantile, juvenile, and presenile cataract"
3672A,11,0.00275%,ASTIGMATISMUS,Astigmatism
3673A,11,0.00275%,ANISOMETROPIA ET ANISEIKONIA,Anisometropia and aniseikonia
3714A,11,0.00275%,DEGENERATIO CORNEAE,Corneal degenerations
3715A,11,0.00275%,EROSIO CORNEAE RECURRENS,Hereditary corneal dystrophies
4372A,11,0.00275%,ENCEPHALOPATHIA HYPERTENSIVA,Hypertensive encephalopathy
4419X,11,0.00275%,ANEURYSMA/DISSECATIO AORTAE ALIA DEF.NONRUPTURATA,Aortic aneurysm of unspecified site without mention of rupture
4748X,11,0.00275%,MORBI CHRONICI TONSILLAE ALIA DEFINITA,Other chronic disease of tonsils and adenoids
4749X,11,0.00275%,MORBI CHRONICI TONSILLAE NUD,Unspecified chronic disease of tonsils and adenoids
4785B,11,0.00275%,LEUKOPLAKIA PLICAE VOCALIS,Other diseases of vocal cords
4928X,11,0.00275%,EMPHYSEMA ALIA DEFINITA,Other emphysema
5010A,11,0.00275%,ASBESTOSIS,Asbestosis
5088A,11,0.00275%,MORBI ORGANORUM RESPIRATIONIS E PHARMACO,Respiratory conditions due to other specified external agents
5224A,11,0.00275%,PERIODONTITIS APICALIS ACUTA (OSTITIS PERIAPICALIS,Acute apical periodontitis of pulpal origin
5251A,11,0.00275%,EDENTATIO ACQUISITA,"Loss of teeth due to trauma, extraction, or periodontal disease"
5320C,11,0.00275%,"ULCUS DUODENI PRAEPYLORI,PERFOROITUNUT",Acute duodenal ulcer with hemorrhage
5321X,11,0.00275%,"ULCUS PYLORI ,MUU",Acute duodenal ulcer with perforation
5351B,11,0.00275%,GASTRITIS ATROPHICANS ANTRI (TYPUS B),Atrophic gastritis
5378C,11,0.00275%,POLYPUS NONNEOPLASTICUS VENTRICULI,Other specified disorders of stomach and duodenum
5512C,11,0.00275%,HERNIA VENTRALIS RECIDIVANS CUM GANGRAENA,Ventral hernia with gangrene
5602A,11,0.00275%,VOLVULUS SIGMAE,Volvulus
5760A,11,0.00275%,SYNDROMA POST CHOLECYSTECTOMIAM,Postcholecystectomy syndrome
6103A,11,0.00275%,FIBROSCLEROSIS MAMMAE,Fibrosclerosis of breast
6236A,11,0.00275%,HAEMATOMA VAGINAE,Vaginal hematoma
6392A,11,0.00275%,HAEMORRHAGIA POST ABORTUM SEU GRAVIDITATEM ECTOPIC,Damage to pelvic organs and tissues following abortion or ectopic and molar pregnancies
6426B,11,0.00275%,"ECLAMPSIA , SYNNYTYKSEN AIKANA","Eclampsia complicating pregnancy, childbirth or the puerperium"
6467X,11,0.00275%,HEPATOPATHIA ALIA GRAVIDARUM,Liver and biliary tract disorders in pregnancy
6801A,11,0.00275%,KAULAPAISE,Carbuncle and furuncle of neck
6810B,11,0.00275%,PARONYCHIA DIGITORUM MANUS,Cellulitis and abscess of finger
6822A,11,0.00275%,CELLULITIS TRUNCI,Cellulitis and abscess of trunk
6918A,11,0.00275%,ECZEMA INFANTUM,Other atopic dermatitis and related conditions
6951D,11,0.00275%,ERYTHEMA FIXUM,Erythema multiforme
6953A,11,0.00275%,ROSACEA,Rosacea
7018X,11,0.00275%,ATROPHIA CUTIS ALIA DEFINITA,Other specified hypertrophic and atrophic conditions of skin
7019X,11,0.00275%,HYPERTROPHIA SEU ATROPHIA CUTIS NUD,Unspecified hypertrophic and atrophic conditions of skin
7183X,11,0.00275%,"LUXATIO HABITUALIS, MÄÄRITTELEMÄTÖN",Recurrent dislocation of joint
7199G,11,0.00275%,"MB ARTICULI NUD,NILKKA",Unspecified disorder of joint
7330B,11,0.00275%,OSTEOPOROSIS PERIPHERICA,Osteoporosis
7334B,11,0.00275%,NECROSIS ASEPTICA CAPITIS ET COLLI FEMORIS,Aseptic necrosis of bone
7364A,11,0.00275%,GENU VALGUM ACQUISITUM,Genu valgum or varum (acquired)
7395A,11,0.00275%,"TUKI- JA LIIKUNTAELINTEN TOIM HÄIR,LANTION ALUE ,","Nonallopathic lesions, pelvic region"
7790A,11,0.00275%,CONVULSIONES CEREBRALES NEONATORUM,Convulsions in newborn
7844A,11,0.00275%,DYSPHONIA HYPERFUNCTIONALIS,Voice and resonance disorders
7844X,11,0.00275%,APHONIA SEU DYSPHONIA ALIA SEU NUD,Voice and resonance disorders
8130X,11,0.00275%,FRACTURA ANTEBRACHII PART SUPER ALIA NON COMPLICATA,"Fracture of upper end of radius and ulna, closed"
8131B,11,0.00275%,FRACTURA CAPITULI RADII COMPLICATA,"Fracture of upper end of radius and ulna, open"
8135B,11,0.00275%,FRACTURA RADII DISTALIS COMPLICATA,"Fracture of lower end of radius and ulna, open"
8451X,11,0.00275%,"DISTORSIO,DISTENSIO SEU RUPTURA PEDIS ALIA",Foot sprain
8511X,11,0.00275%,"CONTUSIO CEREBRI COMPLIC.,TAJUTTOM.KESTO,EI TIETOA",Cortex (cerebral) contusion with open intracranial wound
8630A,11,0.00275%,LAESIO VENTRICULI NON COMPLICATA,"Injury to stomach, without mention of open wound into cavity"
8702A,11,0.00275%,"LACERATIO PALPEBRAE OCULI, CANALE LACRIMALI INCLUSO",Laceration of eyelid involving lacrimal passages
8801A,11,0.00275%,VULNUS REGIONIS SCAPULARIS ET BRACHII COMPLICATUM,"Open wound of shoulder and upper arm, complicated"
8901A,11,0.00275%,VULNUS REGIONIS COXAE ET FEMORIS COMPLICATUM,"Open wound of hip and thigh, complicated"
8940A,11,0.00275%,VULNERA MULTIPLICIA/NUD EXTREMIT.INFER. NON COMPLIC,"Multiple and unspecified open wound of lower limb, without mention of complication"
8941A,11,0.00275%,VULNERA MULTIPLICIA/NUD EXTREMIT.INFERIORIS COMPLIC,"Multiple and unspecified open wound of lower limb, complicated"
9062A,11,0.00275%,SEQUELAE LAESIONUM SUPERFICIALIUM CUTIS,Late effect of superficial injury
9642B,11,0.00275%,MYRKYTYS:PERORAALISET ANTIKOAGULANTIT,Poisoning by anticoagulants
9679X,11,0.00275%,MYRKYTYS:SEDATIIVAT JA UNILÄÄKKEET NUD,Poisoning by unspecified sedative or hypnotic
9809X,11,0.00275%,MYRKYTYS:MUUT MÄÄRITTELEMÄTTÖMÄT ALKOHOLIT,Toxic effect of unspecified alcohol
9810A,11,0.00275%,MYRKYTYS:BENSIINI JA MUUT POLTTOÖLJYTUOTTEET,Toxic effect of petroleum products
9819X,11,0.00275%,MYRKYTYS:MUUT ÖLJYTUOTTEET,Toxic effect of petroleum products
0527A,10,0.00250%,VARICELLA CUM ALIAE COMPLICATIONE DEFINITA,Chickenpox with other specified complications
1309X,10,0.00250%,TOXOPLASMOSIS NUD,"Toxoplasmosis, unspecified"
1540A,10,0.00250%,"NEOPL MALIG JUNCT RECTOSIGM,INVASIIVINEN KARSINOOMA",Malignant neoplasm of rectosigmoid junction
1541X,10,0.00250%,"NEOPLASMA MALIG RECTI,EI HISTOLOGISTA VAHVISTUSTA",Malignant neoplasm of rectum
1725C,10,0.00250%,"MELANOMA MALIGNUM CUTIS TRUNCI,NODULARE","Malignant melanoma of skin of trunk, except scrotum"
1922A,10,0.00250%,NEOPLASMA MALIGNUM MEDULLAE SPINALIS,Malignant neoplasm of spinal cord
2101A,10,0.00250%,NEOPLASMA BENIGNUM LINGUAE,Benign neoplasm of tongue
2150A,10,0.00250%,"NEOPL BENIG CAPITIS, FACIEI ET COLLI,SIDEKUDOSPER","Other benign neoplasm of connective and other soft tissue of head, face, and neck"
2166X,10,0.00250%,"YLÄRAAJAN IHON BEN KASV,TARK MÄÄRITT HYVÄNLAAT KASV","Benign neoplasm of skin of upper limb, including shoulder"
2223A,10,0.00250%,NEOPLASMA BENIGNUM EPIDIDYMIDIS,Benign neoplasm of epididymis
2241A,10,0.00250%,NEOPLASMA BENIGNUM ORBITAE,Benign neoplasm of orbit
2430A,10,0.00250%,HYPOTHYREOSIS CONGENITA,Congenital hypothyroidism
2521A,10,0.00250%,HYPOPARATHYREOIDISMUS,Hypoparathyroidism
2580A,10,0.00250%,MULTIPPELI ENDOKRIININEN NEOPLASIA I (MEN I),Polyglandular activity in multiple endocrine adenomatosis
2731A,10,0.00250%,PARAPROTEINAEMIA MONOCLONALIS,Monoclonal paraproteinemia
2888A,10,0.00250%,LEUCOCYTOSIS,Other specified disease of white blood cells
2938B,10,0.00250%,SYNDROMA DELUSIONALE PSYCHOORGANICUM ALIUD,Other specified transient mental disorders due to conditions classified elsewhere
3092B,10,0.00250%,KOULUFOBIA,Adjustment reaction with predominant disturbance of other emotions
3123X,10,0.00250%,TARKEMMIN MÄÄRITTELEMÄTÖN HILLITSEMISHÄIRIÖ,"Disorders of impulse control, not elsewhere classified"
3199B,10,0.00250%,MUU ÄLYLLINEN KEHITYSVAMMAISUUS JA KÄYTTÄYTYMIHÄIRI,Unspecified intellectual disabilities
3209X,10,0.00250%,MENINGITIS BACTERICA NUD,Meningitis due to unspecified bacterium
3312X,10,0.00250%,DEGENERATIO CEREBRI ALIA SEU NUD,Senile degeneration of brain
3452A,10,0.00250%,STATUS EPILEPTICUS PETIT MAL (ABSENTIA),Petit mal status
3502A,10,0.00250%,DOLORES FACIEI ATYPICI,Atypical face pain
3545A,10,0.00250%,MONONEUROPATHIA MULTIPLEX,Mononeuritis multiplex
3651E,10,0.00250%,GLAUCOMA INFANTILE SEU JUVENILE,Open-angle glaucoma
3699X,10,0.00250%,TARKEMMIN MÄÄRITTELEMÄTÖN NÄÖNHEIKKOUS,Unspecified visual loss
3705A,10,0.00250%,KERATITIS INTERSTITIALIS ET PROFUNDA,Interstitial and deep keratitis
3725A,10,0.00250%,DEGENERATIO CONJUNCTIVAE,Conjunctival degenerations and deposits
3745A,10,0.00250%,DEGENERATIO PALPEBRAE ET REGIONIS PERIOCULARIS,Degenerative disorders of eyelid and periocular area
3780X,10,0.00250%,STRABISMUS CONVERGENS ALIUS,Esotropia
4308X,10,0.00250%,HAEMORRHAGIA SUBARACHNOIDALIS ALIA DEFINITA,Subarachnoid hemorrhage
4321A,10,0.00250%,HAEMORRHAGIA SUBDURALIS NONTRAUMATICA,Subdural hemorrhage
4401A,10,0.00250%,ARTERIOSCLEROSIS ARTERIAE RENALES,Atherosclerosis of renal artery
4448X,10,0.00250%,EMBOLIA SEU TROMBOSIS  ARTERIAE ALIA DEFINITA,Embolism and thrombosis of other specified artery
4568X,10,0.00250%,VARICES ALIAE LOCO DEFINITO,Varices of other sites
4571A,10,0.00250%,LYMPHOEDEMA ALIA,Other lymphedema
5130A,10,0.00250%,ABSCESSUS PULMONUM,Abscess of lung
5260B,10,0.00250%,KERATOCYSTA (CYSTA PRIMORDIALIS),Developmental odontogenic cysts
5273A,10,0.00250%,ABSCESSUS GLANDULAE SALIVARIUM,Abscess of salivary gland
5278A,10,0.00250%,SIALADENOSIS,Other specified diseases of the salivary glands
5518X,10,0.00250%,HERNIA ABDOMINALIS CUM GANGRAENA ALTERIUS LOCO DEF,"Hernia of other specified sites, with gangrene"
5799X,10,0.00250%,MALABSORPTIO NUD,Unspecified intestinal malabsorption
5902A,10,0.00250%,ABSCESSUS RENALIS ET PERIRENALIS,Renal and perinephric abscess
5990D,10,0.00250%,PYURIA,"Urinary tract infection, site not specified"
6079X,10,0.00250%,MORBUS PENIDIS NUD,Unspecified disorder of penis
6254A,10,0.00250%,PREMENSTRUAL TENSION,Premenstrual tension syndromes
6259X,10,0.00250%,SYMPTOMATA ORGANORUM GENITALIS MULIERIS NUD,Unspecified symptom associated with female genital organs
6426A,10,0.00250%,"ECLAMPSIA , ENNEN SYNNYTYSTÄ","Eclampsia complicating pregnancy, childbirth or the puerperium"
6528A,10,0.00250%,"MUUT VIRHEASENNOT JA -TARJONNAT, RASKAUDEN AIKANA",Other specified malposition or malpresentation of fetus
6538B,10,0.00250%,"DISPROPORTIO FOETOPELVICA,ALIA DEFINITA,SYNN AIK","Disproportion of other origin in pregnancy, labor, and delivery"
6540A,10,0.00250%,"MALEFORMATIO UTERI CONGENITA, RASKAUDEN AIKANA","Congenital abnormalities of uterus complicating pregnancy, childbirth, or the puerperium"
6567B,10,0.00250%,"CONDITIO PLACENTAE ALIA, SYNNYTYKSEN AIKANA",Other placental conditions affecting management of mother
6648B,10,0.00250%,TRAUMATA PERINEALIA ET VULVAE IN PARTU ALIA DEF,Other specified trauma to perineum and vulva during delivery
6758X,10,0.00250%,MASTITIS ALIA PUERP AIKANA,Other specified infections of the breast and nipple associated with childbirth
6807A,10,0.00250%,CARBUNCULUS PEDIS,Carbuncle and furuncle of foot
6809X,10,0.00250%,CARBUNCULUS NUD,Carbuncle and furuncle of unspecified site
6824A,10,0.00250%,"CELLULITIS MANUS, DIGITIS EXCEPTIS","Cellulitis and abscess of hand, except fingers and thumb"
6831A,10,0.00250%,LYMPHADENITIS ACUTA AXILLAE,Acute lymphadenitis
6925A,10,0.00250%,DERMATITIS ARTEFACTA EX ALIMENTIS TOXICA (VÄLITÖN),Contact dermatitis and other eczema due to food in contact with skin
6961B,10,0.00250%,PSORIASIS PUSTULARIS,Other psoriasis
7018B,10,0.00250%,ELASTOSIS SENILIS,Other specified hypertrophic and atrophic conditions of skin
7029X,10,0.00250%,DERMATOSIS NUD,Other dermatoses
7183E,10,0.00250%,"LUXATIO HABITUALIS, LONKKANIVEL",Recurrent dislocation of joint
7229X,10,0.00250%,MORBUS DISCI INTERVERTEBRALIS NUD,Other and unspecified disc disorder
7266B,10,0.00250%,TENDINITIS SEU BURSITIS REGIONIS LIG GENUS COLL MED,Enthesopathy of knee
7266G,10,0.00250%,SDR TRACTUS ILIOTIBIALE,Enthesopathy of knee
7276E,10,0.00250%,RUPTURA NONTRAUMATICA TENDINIS PATELLAE,"Rupture of tendon, nontraumatic"
7282A,10,0.00250%,ATROPHIA MUSCULORUM NUD,"Muscular wasting and disuse atrophy, not elsewhere classified"
7505A,10,0.00250%,STENOSIS PYLORI HYPERTROPHICANS CONGENITA ET INFAN,Congenital hypertrophic pyloric stenosis
7546B,10,0.00250%,PES PLANUS CONGENITUS,"Valgus deformities of feet, congenital"
7550A,10,0.00250%,POLYDACTYLIA DIGITORUM I MANUS,Polydactyly
7562A,10,0.00250%,COSTA CERVICALIS,Cervical rib
7764A,10,0.00250%,POLYCYTHAEMIA NEONATORUM,Polycythemia neonatorum
7801A,10,0.00250%,HALLUCINATIO,Hallucinations
7860X,10,0.00250%,RESPIRATIO ABNORMA NUD,Dyspnea and respiratory abnormalities
7864A,10,0.00250%,SPUTUM ABNORME,Abnormal sputum
7880A,10,0.00250%,COLICA RENALIS,Renal colic
7902A,10,0.00250%,POIKKEAVA SOKERIRASITUSKOE,Abnormal glucose
7934A,10,0.00250%,RUOANSULATUSELINTEN EPÄSPES POIK SÄDEDIAGN LÖYD,Nonspecific (abnormal) findings on radiological and other examination of gastrointestinal tract
7964A,10,0.00250%,MUU POIKKEAVA KLIININEN LÖYDÖS,Other abnormal clinical findings
8001A,10,0.00250%,FRACT VERTICIS CRANII NON COMPL CUM LAES INTRACRAN,Closed fracture of vault of skull with cerebral laceration and contusion
8056X,10,0.00250%,"RISTI-HÄNTÄLUUN MÄÄRITTELEMÄTÖN MURTUMA,EI SPIN VAU",Closed fracture of sacrum and coccyx without mention of spinal cord injury
8060A,10,0.00250%,KAULARANGAN KOMPRESSIOMURTUMA JA SELKÄYDINVAURIO,Closed fracture of cervical vertebra with spinal cord injury
8160B,10,0.00250%,"FRACTURA DIGITI II MANUS, NON COMPLICATA",Closed fracture of one or more phalanges of hand
8160X,10,0.00250%,"FRACTURA DIGITORUM VARIORUM MANUS,NON COMPLICATA",Closed fracture of one or more phalanges of hand
8161D,10,0.00250%,"FRACTURA DIGITI IV MANUS, COMPLICATA",Open fracture of one or more phalanges of hand
8522X,10,0.00250%,"HAEMORRHAGIA SUBDURALIS TR,TAJUT KESTOSTA EI TIETOA",Subdural hemorrhage following injury without mention of open intracranial wound
8524A,10,0.00250%,"HAEMORRHAGIA EPIDURALIS TR ,EI TIETOA TAJUTTOMUUDES",Extradural hemorrhage following injury without mention of open intracranial wound
8603A,10,0.00250%,HAEMOTHORAX TRAUMATICUS COMPLICATUS,Traumatic hemothorax with open wound into thorax
8641A,10,0.00250%,LAESIO TRAUMATICA HEPATIS COMPLICATA,Injury to liver with open wound into cavity
8701A,10,0.00250%,"LACERATIO PALPEBRAE OCULI, CANALE LACRIMALI EXCLUSO","Laceration of eyelid, full-thickness, not involving lacrimal passages"
8800A,10,0.00250%,VULNUS REGIONIS SCAPULARIS/BRACHII NON COMPLICATUM,"Open wound of shoulder and upper arm, without mention of complication"
8802A,10,0.00250%,"VULN.SCAPULARIS/BRACHII+LAESIONE TENDINIS,NON COMPL","Open wound of shoulder and upper arm, with tendon involvement"
8841A,10,0.00250%,"VULNERA MULTIPLICIA/NUD EXTREMIT. SUPERIORIS,COMPLI","Multiple and unspecified open wound of upper limb, complicated"
8932A,10,0.00250%,"VULNUS DIGITI PEDIS CUM LAESIONE TENDINIS,NON COMPL","Open wound of toe(s), with tendon involvement"
9245X,10,0.00250%,CONTUSIO EXTREMITATIS INFERIORIS NUD,Contusion of unspecified part of lower limb
9261A,10,0.00250%,VARTALON MURSKAVAMMA MUU,Crushing injury of other specified sites of trunk
9273A,10,0.00250%,SORMIEN MURSKAVAMMA,Crushing injury of finger(s)
9452B,10,0.00250%,"COMBUSTIO EXTREMITATIS INFERIORIS GRADUS II, 10-29%",Blisters with epidermal loss due to burn [second degree] of lower limb(s)
9551A,10,0.00250%,LAESIO TRAUMATICA NERVI MEDIANI,Injury to median nerve
9563A,10,0.00250%,LAESIO TRAUMATICA NERVI PERONEI,Injury to peroneal nerve
9941A,10,0.00250%,"HUKKUMINEN, HUKKUMISVAARA TAI VETEEN JOUTUMINEN",Drowning and nonfatal submersion
V450A,10,0.00250%,MUUN TOIMENPITEEN JÄLKISEURANTA,Cardiac pacemaker in situ
0544C,9,0.00225%,"KERATITIS DISCIFORMIS, HERPETICA",Herpes simplex with ophthalmic complications
1120A,9,0.00225%,CANDIDIASIS ORALIS,Candidiasis of mouth
1122A,9,0.00225%,CANDIDIASIS BALANITIS,Candidiasis of other urogenital sites
1623X,9,0.00225%,"NEOPL MAL LOB SUPER PULMONIS,EI HIST/SYTOL DG","Malignant neoplasm of upper lobe, bronchus or lung"
1727A,9,0.00225%,"MELANOMA MAL CUTIS EXTR INFER,MELAN EX LENTIGOMAL","Malignant melanoma of skin of lower limb, including hip"
1727C,9,0.00225%,"MELANOMA MAL CUTIS EXTR INFER,NODULARE","Malignant melanoma of skin of lower limb, including hip"
1733C,9,0.00225%,"KASVOJEN IHON SYÖPÄ,MUU",Other and unspecified malignant neoplasm of skin of other and unspecified parts of face
1891X,9,0.00225%,"NEOPLASMA MALIGNUM PELVIS RENIS,EI HIST VAHV",Malignant neoplasm of renal pelvis
2253A,9,0.00225%,NEOPLASMA BENIGNUM MEDULLAE SPINALIS,Benign neoplasm of spinal cord
2387X,9,0.00225%,STATUS LYMPHO- ET MYELOPROLIFERATIVUS NUD,Neoplasm of uncertain behavior of other lymphatic and hematopoietic tissues
2662A,9,0.00225%,HYPOVITAMINOSIS B12,Other B-complex deficiencies
2729X,9,0.00225%,MORBI CONGENITI METABOLICI LIPOIDICI NUD,Unspecified disorder of lipoid metabolism
2810A,9,0.00225%,ANAEMIA PERNICIOSA CUM MYELOPATHIA SPINALI,Pernicious anemia
