ICD9,n_codes,freq_finngen_per,Finnish_name,possible_english_name
8411A,31,0.00776%,DISTOR/DISTEN/RUPT. LIGAMENTI COLLATERALIS ULNARIS,Ulnar collateral ligament sprain
8510C,31,0.00776%,"CONTUSIO CEREBRI NON COMP,<1H KESTÄNYT TAJUTTOMUUS",Cortex (cerebral) contusion without mention of open intracranial wound
9695X,31,0.00776%,MYRKYTYS:MUUT RAUHOITTAVAT AINEET,Poisoning by other tranquilizers
0110X,30,0.00751%,"TUBERCULOSIS PULMONUM INFILTRATIVA, EPÄILTY","Tuberculosis of lung, infiltrative"
0340X,30,0.00751%,"TONSILLITIS STREPTOCOCCICA,MUU STREPTOC BETAHAEMOL",Streptococcal sore throat
0798X,30,0.00751%,INFECTIO VIROSA ALIA DEFINITA,Other specified viral and chlamydial infections in conditions classified elsewhere and of unspecified site
2210A,30,0.00751%,NEOPLASMA BENIGNUM ADNEXAE,Benign neoplasm of fallopian tube and uterine ligaments
2963E,30,0.00751%,"PSYCH.BIPOLARIS DEPRESSIVA,VAIKEA-ASTE,PSYKOOT PIIR","Major depressive disorder, recurrent episode"
3519X,30,0.00751%,MORBUS NERVI FACIALIS NUD,"Facial nerve disorder, unspecified"
3890A,30,0.00751%,HYPACUSIS CONDUCTIVA,Conductive hearing loss
4478X,30,0.00751%,MORBI ARTERIAE ET ARTERIOLAE ALIA DEFINITA,Other specified disorders of arteries and arterioles
4589X,30,0.00751%,HYPOTONIA NUD,"Hypotension, unspecified"
5522A,30,0.00751%,HERNIA VENTRALIS CUM OBSTRUCTIONE,Ventral hernia with obstruction
5771D,30,0.00751%,PANCREATITIS CHRONICA ALCOHOLICA NUD,Chronic pancreatitis
5990A,30,0.00751%,BACTERIURIA ASYMPTOMATICA,"Urinary tract infection, site not specified"
6358C,30,0.00751%,"ABORT PROV LEGAL CUM COMPL AL,SOSIAALISET SYYT",Legally induced abortion with unspecified complication
6743A,30,0.00751%,COMPLICATIO ALIA OBSTETRICA POSTOPERATIVA,Other complications of obstetrical surgical wounds
6970A,30,0.00751%,LICHEN RUBER PLANUS,Lichen planus
7209X,30,0.00751%,SPONDYLITIS NUD,Unspecified inflammatory spondylopathy
7230A,30,0.00751%,STENOSIS CANALIS SPINALIS CERVICALIS,Spinal stenosis in cervical region
7482A,30,0.00751%,MEMBRANA LARYNGIS (STENOSIS LARYNGIS),Web of larynx
7876A,30,0.00751%,INCONTINENTIA SPHINCTERIS ANI,Incontinence of feces
7899X,30,0.00751%,SYMPTOMATA ABDOMINIS ET PELVIS ALIA DEFINITA,Other symptoms involving abdomen and pelvis
7915A,30,0.00751%,GLUCOSURIA,Glycosuria
8400A,30,0.00751%,DISTORSIO/DISTEN./RUPT.ARTICULI ACROMIOCLAVICULARIS,Acromioclavicular (joint) (ligament) sprain
8812B,30,0.00751%,"VULN.CUBITI/ANTEBRACHII/CARPI+LAESIO TENDINIS,COMP","Open wound of elbow, forearm, and wrist, with tendon involvement"
9281A,30,0.00751%,POLVEN JA SÄÄREN MURSKAVAMMA,Crushing injury of knee and lower leg
9983A,30,0.00751%,LEIKKAUSHAAVAN REPEÄMINEN,Disruption of wound
V828A,30,0.00751%,SEULONTATUTKIMUS,Screening for other specified conditions
0084E,29,0.00726%,ENTERITIS CAMPYLOBACTER,Intestinal infection due to other specified bacteria
2399X,29,0.00726%,NEOPLASMA NON DEFINITUM LOCO NON DEF,"Neoplasm of unspecified nature, site unspecified"
2441A,29,0.00726%,HYPOTHYREOSIS POST HYPERTHYREOSIM CURATAM ALIA,Other postablative hypothyroidism
2512B,29,0.00726%,HYPOGLYCAEMIA ALIA (SINE HYPERINSULINISMO),"Hypoglycemia, unspecified"
2724A,29,0.00726%,DYSLIPOPROTEINAEMIA,Other and unspecified hyperlipidemia
2773A,29,0.00726%,AMYLOIDOSIS PRIMARIA,Amyloidosis
3011D,29,0.00726%,MIELIALAN AALTOILUHÄIRIÖ,Affective personality disorder
3092C,29,0.00726%,TYÖNTEON/OPINTOJEN ESTYMISENÄ ILM. SOPEUTUMISHÄIRIÖ,Adjustment reaction with predominant disturbance of other emotions
4130C,29,0.00726%,"ANGINA PECTORIS (""EFFORT ANGINA""),TROMBI",Angina decubitus
4410A,29,0.00726%,ANEURYSMA AORTAE DISSECANS,Dissecting aneurysm of aorta
5838X,29,0.00726%,NEPHRITIS INTERSTITIALIS CHRONICA ALIA DEFINITA,"Nephritis and nephropathy, not specified as acute or chronic, with other specified pathological lesion in kidney"
5982A,29,0.00726%,STRICTURA URETHRAE POSTOPERATIVA,Postoperative urethral stricture
6019X,29,0.00726%,PROSTATITIS NUD,"Prostatitis, unspecified"
6100A,29,0.00726%,CYSTA MAMMAE SOLITARIA,Solitary cyst of breast
6338X,29,0.00726%,GRAVIDITAS ECTOPICA ALIA DEFINITA,Other ectopic pregnancy
6431A,29,0.00726%,HYPEREMESIS GRAVIDARUM CUM DISTURBATIONE METABOL,Hyperemesis gravidarum with metabolic disturbance
7230B,29,0.00726%,SUBLUXATIO ATLANTO-AXIALIS,Spinal stenosis in cervical region
7279X,29,0.00726%,"MB SYNOVIAE, TENDINIS ET BURSAE NUD","Unspecified disorder of synovium, tendon, and bursa"
7451B,29,0.00726%,"""DOUBLE OUTLET RIGHT VENTRICLE""",Transposition of great vessels
7492C,29,0.00726%,CHEILOPALATOSCHISIS BILATERALIS COMPLETA,Cleft palate with cleft lip
8062A,29,0.00726%,RINTARANGAN KOMPRESSIOMURTUMA JA SELKÄYDINVAURIO,Closed fracture of dorsal vertebra with spinal cord injury
8221A,29,0.00726%,FRACTURA PATELLAE COMPLICATA,Open fracture of patella
8650A,29,0.00726%,LAESIO TRAUMATICA LIENIS NON COMPLICATA,Injury to spleen without mention of open wound into cavity
8660A,29,0.00726%,LAESIO TRAUMATICA RENIS NON COMPLICATA,Injury to kidney without mention of open wound into cavity
9658X,29,0.00726%,MYRKYTYS:MUUT MÄÄRITELLYT ANALGEETIT,Poisoning by other specified analgesics and antipyretics
2459X,28,0.00701%,THYREOIDITIS NUD,"Thyroiditis, unspecified"
2999A,28,0.00701%,"LAPSUUDEN LAAJA-AL.KEHITYSHÄIR,NUD,TÄYDEL OIREYHTYM",Unspecified pervasive developmental disorder
3665A,28,0.00701%,CATARACTA SECUNDARIA,After-cataract
5648X,28,0.00701%,MUU SUOLISTON TOIMINTAHÄIRIÖ,Other specified functional disorders of intestine
5759X,28,0.00701%,SAPPIRAKON SAIRAUS NUD,Unspecified disorder of gallbladder
6248X,28,0.00701%,MORBI NONINFECTIOSI VULVAE ET PERINEI ALIA DEFINITA,Other specified noninflammatory disorders of vulva and perineum
6869X,28,0.00701%,INFECTIONES LOCALES CUTIS ET SUBCUTIS NUD,Unspecified local infection of skin and subcutaneous tissue
7041A,28,0.00701%,HIRSUTISMUS,Hirsutism
7181B,28,0.00701%,"NIVELHIIRI,KYYNÄRNIVEL",Loose body in joint
7289X,28,0.00701%,"MORBI MUSCULI, LIGAMENTI ET FASCIAE NUD","Unspecified disorder of muscle, ligament, and fascia"
7336A,28,0.00701%,SYNDROMA TIETZE,Tietze's disease
7444D,28,0.00701%,FISTULA SEU SINUS PRAEAURICULARIS,Branchial cleft cyst or fistula; preauricular sinus
7448X,28,0.00701%,MUU KASVOJEN JA KAULAN EPÄMUODOSTUMA,Other specified congenital anomalies of face and neck
7460C,28,0.00701%,VITIUM VALVULAE PULMONALIS CONGENITA CUM STENOSIS,"Anomalies of pulmonary valve, congenital"
7540A,28,0.00701%,"MALEFORM REGIO CRANII,FACIEI,MAXILLAE,MANDIBULAE","Congenital musculoskeletal deformities of skull, face, and jaw"
7561X,28,0.00701%,MALEFORMATIONES COLUMNAE VERTEBRALIS ALIAE,"Anomalies of spine, congenital"
7998X,28,0.00701%,MUUT RIITTÄMÄTÖMÄSTI MÄÄRITELLYT TILAT,Other ill-defined conditions
8208X,28,0.00701%,"FRACTURA COLLI FEMORIS NUD, NON COMPLICATA",Closed fracture of unspecified part of neck of femur
8212X,28,0.00701%,FRACTURA FEMORIS PARTIS ALTER.INFERIORIS NON COMPLI,"Fracture of lower end of femur, closed"
8472A,28,0.00701%,"DISTORSIO,DISTENSIO/RUPT. MUSCULI REGIONIS LUMBALIS",Sprain of lumbar
8510E,28,0.00701%,"CONTUSIO CEREBRI NON COMP,>24 H KESTÄNYT TAJUTTOMUU",Cortex (cerebral) contusion without mention of open intracranial wound
8700A,28,0.00701%,LACERATIO CUTIS PALPEBRAE OCULI/REG. PERIOCULARIS,Laceration of skin of eyelid and periocular area
9952A,28,0.00701%,"LÄÄKKEEN, BIOL VAIK AIN TARK MÄÄR EPÄSUOT VAIK","Other and unspecified adverse effect of drug, medicinal and biological substance"
9974A,28,0.00701%,MAHASUOLIKANAVAN KOMPLIKAATIO,Digestive system complications
0701A,27,0.00675%,HEPATITIS A SINE COMATE HEPATICO,Viral hepatitis A without mention of hepatic coma
1369X,27,0.00675%,MORBI INFECTIOSI ET PARASITARII NUD,Unspecified infectious and parasitic diseases
1370A,27,0.00675%,"HENGITYSELINTUBERKUL JÄLKITILA,TUBERKULOOSIARPI",Late effects of respiratory or unspecified tuberculosis
1370X,27,0.00675%,"HENGITYSELINTUBERKUL JÄLKITILA,MUU JÄLKITILA",Late effects of respiratory or unspecified tuberculosis
1533A,27,0.00675%,"NEOPL MALIG COLI SIGM,INVASIIVINEN KARSINOOMA",Malignant neoplasm of sigmoid colon
2165X,27,0.00675%,"VARTALON IHON BEN KASVAIN,TARK MÄÄRITT HYVÄNLAAT KA","Benign neoplasm of skin of trunk, except scrotum"
2383A,27,0.00675%,NEOPLASMA NON DEFINITUM MAMMMAE,Neoplasm of uncertain behavior of breast
2532A,27,0.00675%,PANHYPOPITUITARISMUS,Panhypopituitarism
4431A,27,0.00675%,THROMBANGIITIS OBLITERANS (MORBUS BéRGER),Thromboangiitis obliterans [Buerger's disease]
5246A,27,0.00675%,PURENNAN FYSIOLOGISET HÄIRIÖT,Temporomandibular joint disorders
5322F,27,0.00675%,"ULCUS BULBI,ARPI TAI PARANTUNUT",Acute duodenal ulcer with hemorrhage and perforation
5500B,27,0.00675%,"HERNIA INGUINALIS CUM GANGRAENA,LATERALIS (SCROT)","Inguinal hernia, with gangrene"
5621D,27,0.00675%,DIVERTICULOSIS COLI PERFORATA,Diverticula of colon
5651B,27,0.00675%,FISTULA ANORECTALIS,Anal fistula
5822B,27,0.00675%,"GLOMERULONEPHRITIS CHRONICA MESANGIOCAP,NEFR SDR",Chronic glomerulonephritis with lesion of membranoproliferative glomerulonephritis
6150B,27,0.00675%,"ENDOMETRITIS, ENDOMYOMETR ET PERIMETR AC, CUM ""IUD""","Acute inflammatory diseases of uterus, except cervix"
6476A,27,0.00675%,VIROSES ALIAE IN  GRAVIDITATE,"Other viral diseases complicating pregnancy, childbirth, or the puerperium"
6487A,27,0.00675%,MORBUS SYSTEMATIS MUSCULOSCELETALIS IN GRAVIDITATE,"Bone and joint disorders of back, pelvis, and lower limbs of mother, complicating pregnancy, childbirth, or the puerperium"
6588A,27,0.00675%,"MUU AMNIONONTELON TAI MEMBRAANIEN HÄIRIÖ,RASK AIK",Other problems associated with amniotic cavity and membranes
6638X,27,0.00675%,COMPLICATIONES FUNICULI UMBILICALIS ALIA DEFINITA,Other umbilical cord complications during labor and delivery
6827A,27,0.00675%,CELLULITIS PEDIS DIGITI EXCEPTIS,"Cellulitis and abscess of foot, except toes"
7079X,27,0.00675%,ULCUS CHRONICUS CUTIS NUD,Chronic ulcer of unspecified site
7266D,27,0.00675%,TENDINITIS SEU APICITIS PATELLAE,Enthesopathy of knee
7298X,27,0.00675%,MUU PEHMYTOSIEN SAIRAUS,Other musculoskeletal symptoms referable to limbs
7490C,27,0.00675%,PALATOSCHISIS SUBMUCOSAE,Cleft palate
7800A,27,0.00675%,COMA ET STUPOR,Alteration of consciousness
7941A,27,0.00675%,POIKKEAVA ELEKTRONYSTAGMOGRAMMI,Nonspecific abnormal results of function study of peripheral nervous system and special senses
8203B,27,0.00675%,"FRACTURA COLLI FEMORIS SUBTROCHANTERICA,NON COMPLIC","Pertrochanteric fracture of femur, open"
8850A,27,0.00675%,AMPUTATIO TRAUMATICA POLLICIS (TOT/PART)NON COMPLIC,"Traumatic amputation of thumb (complete)(partial), without mention of complication"
0780A,26,0.00650%,MOLLUSCUM CONTAGIOSUM,Molluscum contagiosum
2270A,26,0.00650%,NEOPLASMA BENIGNUM GLANDULAE SUPRARENALIS,Benign neoplasm of adrenal gland
3432B,26,0.00650%,"CP-OIREYHTYMÄ,DYSTONIA TETRAPLEGICA",Congenital quadriplegia
3555A,26,0.00650%,SYNDROMA CANALIS TARSALIS,Tarsal tunnel syndrome
3881A,26,0.00650%,TRAUMA ACUSTICUM,Noise effects on inner ear
4378X,26,0.00650%,MORBUS CERBROVASCULARIS ALIA DEFINITA,Other ill-defined cerebrovascular disease
4643A,26,0.00650%,EPIGLOTTITIS ACUTA,Acute epiglottitis
5276A,26,0.00650%,MUCOCELE GLANDULAE SALIVARIUM,Mucocele of salivary gland
5322X,26,0.00650%,"ULCUS BULBI,MUU",Acute duodenal ulcer with hemorrhage and perforation
5698C,26,0.00650%,PERFORATIO INTESTINALIS,Other specified disorders of intestine
5809A,26,0.00650%,"GLOMERULONEPHRITIS ACUTA NUD,EI NEFR SDR",Acute glomerulonephritis with unspecified pathological lesion in kidney
5959X,26,0.00650%,CYSTITIS NUD,"Cystitis, unspecified"
5965X,26,0.00650%,ALIA FUNCTIO LAESA VESICAE URINARIAE,Other functional disorders of bladder
5991A,26,0.00650%,FISTULA URETHRAE,Urethral fistula
6213A,26,0.00650%,HYPERPLASIA ENDOMETRII LEVIS SEU SIMPLEX,Endometrial hyperplasia
6595A,26,0.00650%,"VANHA ENSISYNNYTTÄJÄ, RASKAUDEN AIKANA",Elderly primigravida
7014B,26,0.00650%,CICATRIX HYPERTROPHICA,Keloid scar
7081A,26,0.00650%,URTICARIA ACUTA IDIOPATHICA,Idiopathic urticaria
7093X,26,0.00650%,ALII MORBI DEGENERATIONES CUTIS SEU NUD,Degenerative skin disorders
7199E,26,0.00650%,"MB ARTICULI NUD,LONKKANIVEL",Unspecified disorder of joint
7378X,26,0.00650%,DEFORMATIO CURVATURAE COLUMNAE VERTEBRALIS ALIA DEF,Other curvatures of spine
7444A,26,0.00650%,FISTULA BRANCHIOGENICA,Branchial cleft cyst or fistula; preauricular sinus
7483C,26,0.00650%,TRACHEOMALACIA,"Other anomalies of larynx, trachea, and bronchus"
8364A,26,0.00650%,"LUXATIO PATELLAE, COMPLICATA","Dislocation of patella, open"
8421C,26,0.00650%,DISTORSIO/DISTEN/RUPT.ARTICULI INTERPHALANGEI MANUS,Hand sprain
8900A,26,0.00650%,VULNUS REGIONIS COXAE ET FEMORIS NON COMPLICATUM,"Open wound of hip and thigh, without mention of complication"
0350B,25,0.00625%,ERYSIPELAS STAPHYLOCOCCICA,Erysipelas
0418X,25,0.00625%,INFECTIO BACTERICA ALIA,Other specified bacterial infections in conditions classified elsewhere and of unspecified site
0981A,25,0.00625%,GONORRHOEA ACUTA REGIONIS UROGENITALIS SUPERIORIS,Gonococcal infection (acute) of upper genitourinary tract
1623C,25,0.00625%,"NEOPL MAL LOB SUPER PULMONIS,ADENOCARCINOMA","Malignant neoplasm of upper lobe, bronchus or lung"
2019X,25,0.00625%,MORBUS HODGKIN ALIA DEFINITA SEU NUD,"Hodgkin's disease, unspecified type"
2113X,25,0.00625%,NEOPLASMA BENIGNUM ALIUD COLI,Benign neoplasm of colon
2190A,25,0.00625%,NEOPLASMA BENIGNUM CERVICIS UTERI,Benign neoplasm of cervix uteri
2396A,25,0.00625%,"NEOPLASMA NON DEF CEREBRI, CEREBELLI ET TRUNCI CER",Neoplasm of unspecified nature of brain
2502B,25,0.00625%,"COMA DIABETICUM ,TYYPPI I",Diabetes mellitus with hyperosmolarity
2956F,25,0.00625%,"RESIDUAALINEN SKITSOFRENIA,REMISSIOVAIHE",Residual type schizophrenic disorders
3331A,25,0.00625%,TREMOR ESSENTIALIS,Essential and other specified forms of tremor
3682A,25,0.00625%,DIPLOPIA,Diplopia
3740A,25,0.00625%,ENTROPIUM,Entropion and trichiasis of eyelid
3869X,25,0.00625%,VERTIGO OTOGENEA NUD,Unspecified vertiginous syndromes and labyrinthine disorders
3942A,25,0.00625%,STENOSIS ET INSUFFICIENTIA MITRALIS RHEUMATICA,Mitral stenosis with insufficiency
4148B,25,0.00625%,"MORBUS CORDIS ISCHAEMICUS ALIA,AHTAUTUNUT",Other specified forms of chronic ischemic heart disease
4263A,25,0.00625%,"""LEFT BUNDLE BRANCH BLOCK (COMPLETE)""",Other left bundle branch block
4298A,25,0.00625%,ASTHENIA VASOREGULATORIA,Other ill-defined heart diseases
4789X,25,0.00625%,MB TRACTUS RESPIRATIONIS SUPERIORIS ALIA DEF/NUD,Other and unspecified diseases of upper respiratory tract
4808X,25,0.00625%,PNEUMONIA VIROSA ALIA DEFINITA,Pneumonia due to other virus not elsewhere classified
5420A,25,0.00625%,APPENDICITIS CHRONICA,Other appendicitis
5929X,25,0.00625%,CALCULI RENALES ET URETERUM NUD,"Urinary calculus, unspecified"
5941A,25,0.00625%,CALCULI VESICAE URINARIAE,Other calculus in bladder
5952A,25,0.00625%,CYSTITIS CHRONICA ALIA,Other chronic cystitis
5965A,25,0.00625%,HYPERREFLEXIA VESICAE URINARIAE,Other functional disorders of bladder
6161A,25,0.00625%,VAGINITIS ET VULVOVAGINITIS,Vaginitis and vulvovaginitis
6224A,25,0.00625%,STRICTURA CERVICIS UTERI,Stricture and stenosis of cervix
6923B,25,0.00625%,DERMATITIS ARTEFACTA E PHARMACIS ALLERGICA,Contact dermatitis and other eczema due to drugs and medicines in contact with skin
6928X,25,0.00625%,MUU KOSKETUSIHOTTUMA,Contact dermatitis and other eczema due to other specified agents
7118X,25,0.00625%,"ARTHRITIS POSTINFECTIOSA ALIA,  MÄÄRITTELEMÄTÖN",Arthropathy associated with other infectious and parasitic diseases
7152D,25,0.00625%,"OSTEORTHROSIS SECUNDARIA,KÄSI","Osteoarthrosis, localized, secondary"
7178D,25,0.00625%,LAESIO LIGAMENTORUM VARIORUM,Other internal derangement of knee
7392A,25,0.00625%,"TUKI- JA LIIKUNTAELINTEN TOIM HÄIR,RINTAKEHÄN ALUE","Nonallopathic lesions, thoracic region"
7456C,25,0.00625%,ASD CANALIS ATRIOVENTRICULARIS COMMUNIS,Endocardial cushion defects
7844L,25,0.00625%,RINOPHONIA SEU RHINOLALIA,Voice and resonance disorders
8511E,25,0.00625%,"CONTUSIO CEREBRI COMPLIC,>24 H KESTÄNYT TAJUTTOMUU",Cortex (cerebral) contusion with open intracranial wound
9422A,25,0.00625%,"COMBUSTIO TRUNCI GRADUS II,<9%",Blisters with epidermal loss due to burn [second degree] of trunk
9630A,25,0.00625%,MYRKYTYS:ANTIHISTAMIINIT,Poisoning by antiallergic and antiemetic drugs
9860A,25,0.00625%,MYRKYTYS:HIILIMONOKSIDI,Toxic effect of carbon monoxide
9986A,25,0.00625%,"LEIKKAUKSEN JÄLKEINEN AVANNE, TARK MÄÄRIT",Persistent postoperative fistula
V250A,25,0.00625%,RASKAUDEN EHKÄISYNEUVONTA,Encounter for general counseling and advice on contraceptive management
0541B,24,0.00600%,HERPES GENITALIS RECIDIVANS,Genital herpes
2114C,24,0.00600%,ADENOMA TUBULARE RECTI ET CANALIS ANALIS,Benign neoplasm of rectum and anal canal
2830A,24,0.00600%,ANAEMIA HAEMOLYTICA AUTOIMMUNISATORIA PRIMARIA,Autoimmune hemolytic anemias
3238B,24,0.00600%,"ENCEPHALITIS (MYELITIS,ENCEPHALOMYELITIS) VIROSA","Other causes of encephalitis, myelitis, and encephalomyelitis"
3321A,24,0.00600%,PARKINSONISMUS SECUNDARIUS,Secondary parkinsonism
3480A,24,0.00600%,CYSTA CEREBRALIS,Cerebral cysts
3483X,24,0.00600%,ENCEPHALOPATHIA NUD,"Encephalopathy, not elsewhere classified"
3538X,24,0.00600%,MORBI RADICULARES ET PLEXUS NERVORUM ALIA DEFINITA,Other nerve root and plexus disorders
3664A,24,0.00600%,CATARACTA DIABETICA,Cataract associated with other disorders
3681A,24,0.00600%,SUBJEKTIIVISET NÄÖN HÄIRIÖT,Subjective visual disturbances
3952A,24,0.00600%,STENOSIS ET INSUFFICIENTIA AORTAE RHEUMATICA,Rheumatic aortic stenosis with insufficiency
4168X,24,0.00600%,HYPERTONIA PULMONALIS SECUNDARIA,Other chronic pulmonary heart diseases
4220A,24,0.00600%,MYOCARDITIS ACUTA INFECTIOSA,Acute myocarditis in diseases classified elsewhere
4462A,24,0.00600%,ANGIITIS HYPERSENSITIVA,Hypersensitivity angiitis
4512A,24,0.00600%,PHLEBITIS/THROMBOPHLEBITIS NUD EXTREM. INFERIORUM,"Phlebitis and thrombophlebitis of lower extremities, unspecified"
4710A,24,0.00600%,POLYPUS CHOANAE,Polyp of nasal cavity
4782A,24,0.00600%,ABSCESSUS PARAPHARYNGEALIS,"Other diseases of pharynx, not elsewhere classified"
5262A,24,0.00600%,LEUKALUIDEN MUUT KYSTAT JA KYSTAMAISET MUUTOKSET,Other cysts of jaws
5283A,24,0.00600%,CELLULITIS ET ABSCESSUS BASEOS ORIS,Cellulitis and abscess of oral soft tissues
5521A,24,0.00600%,HERNIA PARAUMBILICALIS CUM OBSTRUCTIONE,Umbilical hernia with obstruction
5602C,24,0.00600%,VOLVULUS INTESTINI TENUIS,Volvulus
5761X,24,0.00600%,CHOLANGITIS ALIA,Cholangitis
5911A,24,0.00600%,HYDROURETERONEPHROSIS,Hydronephrosis
6109X,24,0.00600%,DYSPLASIA MAMMAE BENIGNA NUD,"Benign mammary dysplasia, unspecified"
6172A,24,0.00600%,ENDOMETRIOSIS TUBAE UTERINAE,Endometriosis of fallopian tube
6175A,24,0.00600%,ENDOMETRIOSIS INTESTINI,Endometriosis of intestine
6238X,24,0.00600%,MORBUS NONINFECTIOSUS VAGINAE ALIA DEFINITA,Other specified noninflammatory disorders of vagina
6481A,24,0.00600%,HYPERTHYREOSIS IN GRAVIDITATE,"Thyroid dysfunction complicating pregnancy, childbirth, or the puerperium"
6549B,24,0.00600%,"ANOMAL ORG PELVICIS AL DEF SEU NUD,SYNNYTYKSEN AIK","Other and unspecified abnormality of organs and soft tissues of pelvis complicating pregnancy, childbirth, and the puerperium"
6584A,24,0.00600%,"AMNIONITIS, RASKAUDEN AIKANA",Infection of amniotic cavity
6619X,24,0.00600%,SYNNYTYKSEN HÄIRIÖ MUU/ NUD,Unspecified abnormality of labor
6658B,24,0.00600%,TRAUMA OBSTETRICUM ALIA DEFINITA,Other specified obstetrical trauma
6805A,24,0.00600%,CARBUNCULUS REGIONIS GLUTEALIS,Carbuncle and furuncle of buttock
7138X,24,0.00600%,ARTHROPATHIA REACTIVA ALIA,Arthropathy associated with other conditions classifiable elsewhere
7278X,24,0.00600%,"MB SYNOVIAE, TENDINIS ET BURSAE ALIA DEFINITA","Other disorders of synovium, tendon, and bursa"
7490B,24,0.00600%,PALATOSCHISIS INCOMPLETA,Cleft palate
7598X,24,0.00600%,ANOMALIAE CONGENITAE ALIAE DEFINITAE,Other specified anomalies
7685A,24,0.00600%,VASTASYNTYNEEN VAIKEA ASFYKSIA,Severe birth asphyxia
7892A,24,0.00600%,SPLENOMEGALIA,Splenomegaly
8121A,24,0.00600%,FRACTURA HUMERI PARTIS SUPERIORIS COMPLICATA,"Fracture of upper end of humerus, open"
8211A,24,0.00600%,"FRACTURA DIAPHYSEOS FEMORIS, COMPLICATA","Fracture of shaft or unspecified part of femur, open"
8213A,24,0.00600%,"FRACT CONDYLI FEMORIS LATERALIS/MEDIALIS,COMPLICATA","Fracture of lower end of femur, open"
8248X,24,0.00600%,"FRACTURA MALLEOLARIS NUD, NON COMPLICATA","Unspecified fracture of ankle, closed"
8792A,24,0.00600%,VULNERA ABDOMINALIS ANTERIORIS NON COMPLICATA,"Open wound of abdominal wall, anterior, without mention of complication"
8861A,24,0.00600%,AMPUTATIO TRAUMATICA DIGITI ALTERIUS COMPLICATA,"Traumatic amputation of other finger(s) (complete) (partial), complicated"
9692A,24,0.00600%,MYRKYTYS:BUTYROFENONIT,Poisoning by butyrophenone-based tranquilizers
0086C,23,0.00575%,ENTERITIS VIROSA ALIA DEFINITA SEU NUD,Enteritis due to specified virus
0703A,23,0.00575%,HEPATITIS B SINE COMATE HEPATICO,Viral hepatitis B without mention of hepatic coma
2134A,23,0.00575%,NEOPLASMA BENIGNUM SCAPULAE ET OSS LONG EXTR SUP,Benign neoplasm of scapula and long bones of upper limb
2362A,23,0.00575%,NEOPLASMA DEFINITUM ALIUD OVARII,Neoplasm of uncertain behavior of ovary
2394A,23,0.00575%,NEOPLASMA NON DEF VESICAE URINARIAE,Neoplasm of unspecified nature of bladder
2508A,23,0.00575%,"DIABETES MELLITUS CUM COMPLICAT NON DESCR,TYP II",Diabetes with other specified manifestations
2808X,23,0.00575%,ANAEMIA SIDEROPENICA ALIA,Other specified iron deficiency anemias
2875A,23,0.00575%,THROMBOCYTOPENIA NON DEFINITA,"Thrombocytopenia, unspecified"
2963A,23,0.00575%,"PSYCHOSIS BIPOLARIS DEPRESSIVA,NUD","Major depressive disorder, recurrent episode"
3054A,23,0.00575%,"ANKSIOLYYTTI-,SEDATIIVA- JA UNILÄÄKEPÄIHTYMYS","Sedative, hypnotic or anxiolytic abuse"
3076B,23,0.00575%,PÄIVÄKASTELU,Enuresis
3432A,23,0.00575%,"CP-OIREYHTYMÄ,TETRAPLEGIA SPASTICA",Congenital quadriplegia
3544A,23,0.00575%,CAUSALGIA,Causalgia of upper limb
3620A,23,0.00575%,RETINOPATHIA DIABETICA NON PROLIFERATIVA,Diabetic retinopathy
3626A,23,0.00575%,DEGENERATIO RETINAE PERIPHERICA,Peripheral retinal degenerations
3656F,23,0.00575%,GLAUCOMA POST UVEITIDEM,Glaucoma associated with other ocular disorders
3899X,23,0.00575%,HYPACUSIS NUD,Unspecified hearing loss
4140A,23,0.00575%,"ATHEROSCLEROSIS ARTER CORON CORDIS,EI AHTAUMAA",Coronary atherosclerosis
5111B,23,0.00575%,PLEURITIS EXSUDATIVA ALIA DEFINITA,"Pleurisy with effusion, with mention of a bacterial cause other than tuberculosis"
5282A,23,0.00575%,STOMATITIS APHTHOSA,Oral aphthae
5321B,23,0.00575%,"ULCUS PYLORI ,VUOTAVA",Acute duodenal ulcer with perforation
5321C,23,0.00575%,"ULCUS PYLORI ,PERFOROITUNUT",Acute duodenal ulcer with perforation
5713X,23,0.00575%,ALKOHOLIMAKSAVAURIO MUU,"Alcoholic liver damage, unspecified"
5758X,23,0.00575%,MUU SAPPIRAKON SAIRAUS,Other specified disorders of gallbladder
5771B,23,0.00575%,PANCREATITIS CHRONICA NONALCOHOLICA NUD,Chronic pancreatitis
5968X,23,0.00575%,MUU RAKKOVIKA,Other specified disorders of bladder
6119X,23,0.00575%,MORBII MAMMAE NUD,Unspecified breast disorder
6261B,23,0.00575%,OLIGOMENORRHOEA,Scanty or infrequent menstruation
6532A,23,0.00575%,"PELVIS ANGUSTA, ANOM APERT SUPER,RASKAUDEN AIKANA","Inlet contraction of pelvis in pregnancy, labor, and delivery"
6594B,23,0.00575%,"""GRAND MULTIPARA"" ,SYNNYTYKSEN AIKANA","Grand multiparity, with current pregnancy"
7078X,23,0.00575%,ULCUS CHRONICUM CUTIS LOCO ALIO DEFINITO,Chronic ulcer of other specified sites
7083A,23,0.00575%,DERMOGRAPHISMUS,Dermatographic urticaria
7119X,23,0.00575%,"ARTHRITIS INFECTIOSA NUD,MÄÄRITTELEMÄTÖN",Unspecified infective arthritis
7131A,23,0.00575%,ARTHROPATHIA REACT CUM MORBO NONINF SYST GASTROINT,Arthropathy associated with gastrointestinal conditions other than infections
7182A,23,0.00575%,"DISLOCATIO SPONTANEA, OLKANIVEL",Pathological dislocation
7188A,23,0.00575%,"MB ARTICULI, LIGAM ET CARTILAG AL DEF,OLKANIVEL","Other joint derangement, not elsewhere classified"
7266X,23,0.00575%,ENTHESOPATHIA GENUS ALIA DEFINITA SEU NUD,Enthesopathy of knee
7276B,23,0.00575%,RUPTURA NONTRAUMATICA TENDINIS EXT MANUS ET CARP,"Rupture of tendon, nontraumatic"
7569X,23,0.00575%,ANOMALIA SYSTEMATIS MUSCULOSCELETALIS ALIA SEU NUD,Other and unspecified anomalies of musculoskeletal system
7650A,23,0.00575%,HYVIN EPÄKYPSÄ VASTASYNTYNYT,Extreme immaturity
7721A,23,0.00575%,HAEMORRHAGIA INTRAVENTRICULARIS/ PERIVENTR. NEONAT,Intraventricular hemorrhage of fetus or newborn
8050X,23,0.00575%,"KAULARANGAN MÄÄRITTELEMÄTÖN MURTUMA,EI SELKÄYDINVAU",Closed fracture of cervical vertebra without mention of spinal cord injury
8133X,23,0.00575%,"FRACTURA PARTIS DIAPHYSEOS RADII ET ULNAE,COMPLICA","Fracture of shaft of radius and ulna, open"
8150X,23,0.00575%,"FRACTURA METACARPALIS MULTIPLEX/NUD,NON COMPLICATA",Closed fracture of metacarpal bones
8241A,23,0.00575%,"FRACTURA MALLEOLI MEDIALIS, COMPLICATA","Fracture of medial malleolus, open"
8247A,23,0.00575%,"FRACTURA TRIMALLEOLARIS, COMPLICATA","Trimalleolar fracture, open"
8350A,23,0.00575%,LUXATIO COXAE NON COMPLICATA,Closed dislocation of hip
9093A,23,0.00575%,SEQUELAE COMPLICATIO TARDA POST THERAPIAM,Late effect of complications of surgical and medical care
9231A,23,0.00575%,CONTUSIO CUBITI ET ANTEBRACHII,Contusion of elbow and forearm
9242A,23,0.00575%,"CONTUSIO TARSI ET PEDIS, DIGITO EXCEPTO","Contusion of ankle and foot, excluding toe(s)"
9832A,23,0.00575%,MYRKYTYS:EMÄKSET (LIPEÄT),Toxic effect of caustic alkalis
9951A,23,0.00575%,ANGIONEUROOTTIONEN ÖDEEMA,"Angioneurotic edema, not elsewhere classified"
0360A,22,0.00550%,MENINGITIS MENINGOCOCCICA,Meningococcal meningitis
0380A,22,0.00550%,SEPTICHAEMIA STREPTOCOCCUC BETAHAEMOLYTICUS,Streptococcal septicemia
1121A,22,0.00550%,CANDIDIASIS VULVOVAGINALIS,Candidiasis of vulva and vagina
2166A,22,0.00550%,"YLÄRAAJAN IHON BEN KASV,NAEVUS PIGMENTOSUS","Benign neoplasm of skin of upper limb, including shoulder"
